user,target,sentiment label,full_text,cleaning_cleaned        ,case_folding
bokkunko,,1,Pajak naik buat bayar utang ngera wong utang negara kebanyakan masuk kantong korupt*or,Pajak naik buat bayar utang ngera wong utang negara kebanyakan masuk kantong koruptor,pajak naik buat bayar utang ngera wong utang negara kebanyakan masuk kantong koruptor
iyoksantoso,Mdy_Asmara1701,1,@Mdy_Asmara1701 Pendapatan mayoritas rakyat Indonesia tidak naik bahkan ada yg turun (dan termasuk para ceboker Mulyono/ ternak Mulyono). Tapi pajak ditambah. Beginilah nasib rakyat jadi sapi perahan untuk kesejahteraan pejabat.,Pendapatan mayoritas rakyat Indonesia tidak naik bahkan ada yang turun dan termasuk para ceboker Mulyono ternak Mulyono Tapi pajak ditambah Beginilah nasib rakyat jadi sapi perahan untuk kesejahteraan pejabat,pendapatan mayoritas rakyat indonesia tidak naik bahkan ada yang turun dan termasuk para ceboker mulyono ternak mulyono tapi pajak ditambah beginilah nasib rakyat jadi sapi perahan untuk kesejahteraan pejabat
terwiwiwiwi,skmxawng,1,@skmxawng Jujur gaji gua naik. Tapi gak berasa karena naik gaji setara sama potongan pajak. Jadi berasa sama aja Mau marah tapi 58% mau berkelanjutan.,Jujur gaji gua naik Tapi tidak berasa karena naik gaji setara sama potongan pajak Jadi berasa sama aja Mau marah tapi mau berkelanjutan,jujur gaji gua naik tapi tidak berasa karena naik gaji setara sama potongan pajak jadi berasa sama aja mau marah tapi mau berkelanjutan
jazzulee,,1,Pajak naik pelayanan buruk masih banyak jalan yang rusak terus duitnya dikemanain?,Pajak naik pelayanan buruk masih banyak jalan yang rusak terus duitnya dikemanain,pajak naik pelayanan buruk masih banyak jalan yang rusak terus duitnya dikemanain
jaenah32,kumparan,1,@kumparan Edan. Pajak periklanan juga sekarang udah 2x lipas sendiri. Gaji kita umr umr keneh. Susah buat minta naik gaji kerjaan overload masih harus dipotong ini itu. Ini akunya yg bodoh apa gimana ya?,Edan Pajak periklanan juga sekarang udah x lipas sendiri Gaji kita umr umr keneh Susah buat minta naik gaji kerjaan overload masih harus dipotong ini itu Ini akunya yang bodoh apa gimana ya,edan pajak periklanan juga sekarang udah x lipas sendiri gaji kita umr umr keneh susah buat minta naik gaji kerjaan overload masih harus dipotong ini itu ini akunya yang bodoh apa gimana ya
indiabcd_ef,kumparan,1,@kumparan Gila ya Indonesia rakyatnya susah cari kerja upah kecil kebutuhan pokok mahal tapi pajak gede... Kocaknya gaji pejabat naik pensiunan pejabat gede tunjangan pejabat gede dan masi banyla yg lolos pajak.... Real nyekik rakyat kecil,Gila ya Indonesia rakyatnya susah cari kerja upah kecil kebutuhan pokok mahal tapi pajak gede Kocaknya gaji pejabat naik pensiunan pejabat gede tunjangan pejabat gede dan masi banyla yang lolos pajak Real nyekik rakyat kecil,gila ya indonesia rakyatnya susah cari kerja upah kecil kebutuhan pokok mahal tapi pajak gede kocaknya gaji pejabat naik pensiunan pejabat gede tunjangan pejabat gede dan masi banyla yang lolos pajak real nyekik rakyat kecil
Ari_Kur88,ardisatriawan,1,@ardisatriawan @SriMulyaniNet pajak naik hasil untuk malaing berdasi dan rakyat anda suruh menanggung ini semua.,pajak naik hasil untuk malaing berdasi dan rakyat anda suruh menanggung ini semua,pajak naik hasil untuk malaing berdasi dan rakyat anda suruh menanggung ini semua
petrikour,,1,ya kalau pajak naik harus setara sama gaji yang juga naik lah,ya kalau pajak naik harus setara sama gaji yang juga naik lah,ya kalau pajak naik harus setara sama gaji yang juga naik lah
lovingluvi,,1,EMANG GEN Z SALAH DAH PAJAK NEGARA NAIK JUGA SALAH GEN Z dunia berputar kek gasing juga karena gen z,EMANG GEN Z SALAH DAH PAJAK NEGARA NAIK JUGA SALAH GEN Z dunia berputar kek gasing juga karena gen z,emang gen z salah dah pajak negara naik juga salah gen z dunia berputar kek gasing juga karena gen z
Ladydydiana06,,1,Pajak naik itu harusnya kembali ke rakyat dlm bentuk pelayanan publik yg murah bahkan gratis kyk di negara maju..di konoha mah pajak naik itu bwt memperkaya pejabatnya doang sedangkan penghasilan rakyat segitu2 aja,Pajak naik itu harusnya kembali ke rakyat dlm bentuk pelayanan publik yang murah bahkan gratis kyk di negara majudi konoha mah pajak naik itu bwt memperkaya pejabatnya doang sedangkan penghasilan rakyat segitu aja,pajak naik itu harusnya kembali ke rakyat dlm bentuk pelayanan publik yang murah bahkan gratis kyk di negara majudi konoha mah pajak naik itu bwt memperkaya pejabatnya doang sedangkan penghasilan rakyat segitu aja
txtfromirfanID,,2,Jangankan naik konsep PPN sejak awal tuh bagi saya agak aneh. Kita beli kok malah harus bayar pajak. Tapi mau ga mau PPN ini (IMO) bisa jadi paling banyak nyumbang ke negara.,Jangankan naik konsep PPN sejak awal tuh bagi saya agak aneh Kita beli kok malah harus bayar pajak Tapi mau ga mau PPN ini IMO bisa jadi paling banyak nyumbang ke negara,jangankan naik konsep ppn sejak awal tuh bagi saya agak aneh kita beli kok malah harus bayar pajak tapi mau ga mau ppn ini imo bisa jadi paling banyak nyumbang ke negara
BlackGeminid,ardisatriawan,1,@ardisatriawan Pajak dll naik terus tiap tahun. Gaji pejabat naik terus dapat tunjangan pula. Rakyat yang nanggung semua,Pajak dll naik terus tiap tahun Gaji pejabat naik terus dapat tunjangan pula Rakyat yang nanggung semua,pajak dll naik terus tiap tahun gaji pejabat naik terus dapat tunjangan pula rakyat yang nanggung semua
el_jastip,jadipossible,1,@jadipossible Narik investasi luar negeri aja sulit. Banyak PHK Eh pajak naik. Udah sakit ni orang.,Narik investasi luar negeri aja sulit Banyak PHK Eh pajak naik Udah sakit ni orang,narik investasi luar negeri aja sulit banyak phk eh pajak naik udah sakit ni orang
96Ikd,,1,Ekonomi lagi lesu ini malah pajak tetep naik. Barang consumer good yg dipakai semua kalangan yg paling banyak kena imbas,Ekonomi lagi lesu ini malah pajak tetep naik Barang consumer good yang dipakai semua kalangan yang paling banyak kena imbas,ekonomi lagi lesu ini malah pajak tetep naik barang consumer good yang dipakai semua kalangan yang paling banyak kena imbas
sinaddddddd,,1,Semalem nangisin pajak wkwkwk Dan siap-siap harga bahan roti naik (meskipun skrg udh naik) Dan siap-siap yg lain. Lancar-lancar rezeki kita ya,Semalem nangisin pajak wkwkwk Dan siapsiap harga bahan roti naik meskipun skrg udh naik Dan siapsiap yang lain Lancarlancar rezeki kita ya,semalem nangisin pajak wkwkwk dan siapsiap harga bahan roti naik meskipun skrg udh naik dan siapsiap yang lain lancarlancar rezeki kita ya
steffanih_,,1,Melihat replyannya kita bener2 udh balik ke sby era era dimana BBM/ pajak naik dikiiittttt aja banyak yg heboh kritik keras gpp bagus sih cuman dulu pas awal kepemimpinan mulyono naikin BBM berkali2 knp pada diem aja ihhh gemeccc ï¸ï¸ï¸,Melihat replyannya kita bener udh balik ke sby era era dimana BBM pajak naik dikiiittttt aja banyak yang heboh kritik keras gpp bagus sih cuman dulu pas awal kepemimpinan mulyono naikin BBM berkali knp pada diem aja ihhh gemeccc,melihat replyannya kita bener udh balik ke sby era era dimana bbm pajak naik dikiiittttt aja banyak yang heboh kritik keras gpp bagus sih cuman dulu pas awal kepemimpinan mulyono naikin bbm berkali knp pada diem aja ihhh gemeccc
ruang_perubahan,,1,Naikin taraf gaji juga lah kalo mau naikin PPN. Enak aja luuuw gaji kita yang cuma segitu-gitu aja (bahkan ada yang underpaid) tapi tetep mau pajak naik. https://t.co/uSZlyHzFKN,Naikin taraf gaji juga lah kalau mau naikin PPN Enak aja luuuw gaji kita yang cuma segitugitu aja bahkan ada yang underpaid tapi tetep mau pajak naik,naikin taraf gaji juga lah kalau mau naikin ppn enak aja luuuw gaji kita yang cuma segitugitu aja bahkan ada yang underpaid tapi tetep mau pajak naik
Bravo_munte,tempodotco,1,@tempodotco Penerimaan pajak negatif diakibatkan faktor salah urus negara oleh birokratuss..birokrat tikus. Phk naik pajak naik TKA import naik Umkm dibiarkan ambruk.,Penerimaan pajak negatif diakibatkan faktor salah urus negara oleh birokratussbirokrat tikus Phk naik pajak naik TKA import naik Umkm dibiarkan ambruk,penerimaan pajak negatif diakibatkan faktor salah urus negara oleh birokratussbirokrat tikus phk naik pajak naik tka import naik umkm dibiarkan ambruk
gyupuppiy,Rizkihadi,1,@Rizkihadi @ardisatriawan Pajak naik buat ngasi gaji sama fasilitas pejabat kementerian yg baru tuh kak kan skrg nambah banyak bgt kementerian,Pajak naik buat ngasi gaji sama fasilitas pejabat kementerian yang baru tuh kak kan skrg nambah banyak bgt kementerian,pajak naik buat ngasi gaji sama fasilitas pejabat kementerian yang baru tuh kak kan skrg nambah banyak bgt kementerian
erzabcdef,kumparan,2,@kumparan gapapa deh pajak naik tapi hasil pajaknya ini jelas gitu loh,gapapa deh pajak naik tapi hasil pajaknya ini jelas gitu loh,gapapa deh pajak naik tapi hasil pajaknya ini jelas gitu loh
weolluna,ernestprakasa,1,@ernestprakasa Kalo gini belanja pun jadi mikir-mikir gaji umr yg cukup ini harus bertarung sama pajak yg naik terus,Kalo gini belanja pun jadi mikirmikir gaji umr yang cukup ini harus bertarung sama pajak yang naik terus,kalo gini belanja pun jadi mikirmikir gaji umr yang cukup ini harus bertarung sama pajak yang naik terus
apralzolam,,1,TAHEEERE LO 58%. GAJI GUA KAGA NAIK TAPI PAJAK GUA NAIK. DEMI ALLAH DENDAM KESUMAT GUA AMA LO PADA 58%. SAMA PAMERINTAH APALAGI BENCI BANGET GUE BENCI YA ALLAH DZOLIM BGT LU PADA. Kaga takut diazab lu pada?,TAHEEERE LO GAJI GUA KAGA NAIK TAPI PAJAK GUA NAIK DEMI ALLAH DENDAM KESUMAT GUA AMA LO PADA SAMA PAMERINTAH APALAGI BENCI BANGET GUE BENCI YA ALLAH DZOLIM BGT LU PADA Kaga takut diazab lu pada,taheeere lo gaji gua kaga naik tapi pajak gua naik demi allah dendam kesumat gua ama lo pada sama pamerintah apalagi benci banget gue benci ya allah dzolim bgt lu pada kaga takut diazab lu pada
MansionN1703,sukaaaabanget,1,@sukaaaabanget @tiwtiwwie @ViantyTJP @ardisatriawan aktualnya pajak itu naik 9%,aktualnya pajak itu naik,aktualnya pajak itu naik
beruaaangkutup,beruaaangkutup,1,Sekarang pajak naik terus tp pajaknya d alirkan kemana impactnya benad2 gak terlihat biaya hidup naik terus sekolah jg naik trus yg turun apa? Kualitas hidup warga menengah kebawah,Sekarang pajak naik terus tp pajaknya d alirkan kemana impactnya benad tidak terlihat biaya hidup naik terus sekolah jg naik trus yang turun apa Kualitas hidup warga menengah kebawah,sekarang pajak naik terus tp pajaknya d alirkan kemana impactnya benad tidak terlihat biaya hidup naik terus sekolah jg naik trus yang turun apa kualitas hidup warga menengah kebawah
beruaaangkutup,,1,Gila yah tapera ppn naik tagihan pajak gak berhenti2 kasusnya rakyat kerja buat keluarganya tp timbal balik ke masyarakat itu gak banyak loh contohnya? Listrik yg supply surplus aja harganya naik terus next..,Gila yah tapera ppn naik tagihan pajak tidak berhenti kasusnya rakyat kerja buat keluarganya tp timbal balik ke masyarakat itu tidak banyak loh contohnya Listrik yang supply surplus aja harganya naik terus next,gila yah tapera ppn naik tagihan pajak tidak berhenti kasusnya rakyat kerja buat keluarganya tp timbal balik ke masyarakat itu tidak banyak loh contohnya listrik yang supply surplus aja harganya naik terus next
padityaynm,kumparan,1,@kumparan PAJAK NAIK MULU UMR NAIKKIN JUGA LAH !,PAJAK NAIK MULU UMR NAIKKIN JUGA LAH,pajak naik mulu umr naikkin juga lah
gambloes1,innovacommunity,1,@innovacommunity Pajak naik 1 % UMR 5 % BBN ...% .dan lain2.bisa 10 % naiknya.,Pajak naik UMR BBN dan lainbisa naiknya,pajak naik umr bbn dan lainbisa naiknya
rezadmumtz,,1,udahh sekarang susah nyari kerja ditambah pajak naik 5th kedepan bisa survive aja udah gila banget,udahh sekarang susah nyari kerja ditambah pajak naik th kedepan bisa survive aja udah gila banget,udahh sekarang susah nyari kerja ditambah pajak naik th kedepan bisa survive aja udah gila banget
forgetiregretti,,1,pajak naik 12% masih aja ngerasa tinggal di negara yang baik-baik aja.,pajak naik masih aja ngerasa tinggal di negara yang baikbaik aja,pajak naik masih aja ngerasa tinggal di negara yang baikbaik aja
Asuha76854995,Mdy_Asmara1701,1,@Mdy_Asmara1701 Kegagalan eman berangkat dr awal rakyat itu menghayal dalam hidupnya bebas pajak dan hutang buk dlm pelolaanya bukan ngoceh hebat tiba tiba beban rakyat naik itu tidak hebat buk menteri mundur aja,Kegagalan eman berangkat dr awal rakyat itu menghayal dalam hidupnya bebas pajak dan hutang buk dlm pelolaanya bukan ngoceh hebat tiba tiba beban rakyat naik itu tidak hebat buk menteri mundur aja,kegagalan eman berangkat dr awal rakyat itu menghayal dalam hidupnya bebas pajak dan hutang buk dlm pelolaanya bukan ngoceh hebat tiba tiba beban rakyat naik itu tidak hebat buk menteri mundur aja
pukupow_,,1,gaji segitu segituh ajah pajak naik terus pantes ni negara ga pernah makmur,gaji segitu segituh ajah pajak naik terus pantes ni negara ga pernah makmur,gaji segitu segituh ajah pajak naik terus pantes ni negara ga pernah makmur
bobajjumbo,,1,Mulai Januari 2025 status kehidupan gua apakah ikut naik juga seperti pajak ntuh? Hmmm,Mulai Januari status kehidupan gua apakah ikut naik juga seperti pajak ntuh Hmmm,mulai januari status kehidupan gua apakah ikut naik juga seperti pajak ntuh hmmm
luqmangar,Strategi_Bisnis,1,@Strategi_Bisnis bukannya turunin iuran pajak ehh malah naik,bukannya turunin iuran pajak ehh malah naik,bukannya turunin iuran pajak ehh malah naik
hadilocoboy,ernestprakasa,1,@ernestprakasa Gimana kalau pajak naik hanya untuk anggota DPR sama mentri nya aja? rakyat gausah.,Gimana kalau pajak naik hanya untuk anggota DPR sama mentri nya aja rakyat gausah,gimana kalau pajak naik hanya untuk anggota dpr sama mentri nya aja rakyat gausah
VonRofX,fajarnugros,1,@fajarnugros Pajak naik kan untuk bayarin ikn sama makan gratis.,Pajak naik kan untuk bayarin ikn sama makan gratis,pajak naik kan untuk bayarin ikn sama makan gratis
LuluIndah22,ernestprakasa,1,@ernestprakasa Pajak blm naik aja menurutku udah mahal kmrn beli gacoan pajaknya 2.900an alias 3k. Parkirnya 2k ditotal udah 5k sendiri.,Pajak blm naik aja menurutku udah mahal kmrn beli gacoan pajaknya an alias k Parkirnya k ditotal udah k sendiri,pajak blm naik aja menurutku udah mahal kmrn beli gacoan pajaknya an alias k parkirnya k ditotal udah k sendiri
rainyinjune,,1,sehat sehat budak corporate yg di dzolimi pemerintah terusss harus kurang2in belanja nya soalnya taun depan pajak naik 12%,sehat sehat budak corporate yang di dzolimi pemerintah terusss harus kurangin belanja nya soalnya taun depan pajak naik,sehat sehat budak corporate yang di dzolimi pemerintah terusss harus kurangin belanja nya soalnya taun depan pajak naik
lyakjs,,1,anjir makin naik aja ni pajak,anjir makin naik aja ni pajak,anjir makin naik aja ni pajak
nnnuuuwis,,1,Pajak naik harga kebutuhan ikut naik potongan makin gede gaji stagnan daya beli menurun.,Pajak naik harga kebutuhan ikut naik potongan makin gede gaji stagnan daya beli menurun,pajak naik harga kebutuhan ikut naik potongan makin gede gaji stagnan daya beli menurun
atelierluluaa,,1,ya allah daya beli lagi turun tapi pajak naik.,ya allah daya beli lagi turun tapi pajak naik,ya allah daya beli lagi turun tapi pajak naik
KRA_RizkiBaruna,,1,Pajak PPN jadi naik januari 2025 jadi 12% Padahal tagline negara ini memajukan UMKM lokal.. Durung maju wis nyetor 12% ke negara.. Berkembang ora kukut kui iyo.. â€,Pajak PPN jadi naik januari jadi Padahal tagline negara ini memajukan UMKM lokal Durung maju wis nyetor ke negara Berkembang ora kukut kui iyo,pajak ppn jadi naik januari jadi padahal tagline negara ini memajukan umkm lokal durung maju wis nyetor ke negara berkembang ora kukut kui iyo
abdul1841660,Rudiyanto_zh,2,@Rudiyanto_zh Pajak naik ngga bang,Pajak naik ngga bang,pajak naik ngga bang
reanameridian,,0,gak mau top up lewat gug3l pl4y lagi... dan pasti harga di kang top up pasti naik juga... dah tau daya beli masyarakat turun karena harga pada mahal malah naikin pajak emang tai,tidak mau top up lewat gugl ply lagi dan pasti harga di kang top up pasti naik juga dah tahu daya beli masyarakat turun karena harga pada mahal malah naikin pajak emang tai,tidak mau top up lewat gugl ply lagi dan pasti harga di kang top up pasti naik juga dah tahu daya beli masyarakat turun karena harga pada mahal malah naikin pajak emang tai
pahitbangwet,kumparan,0,@kumparan gaji ga dinaekin ppn naik mulu. udah tau daya beli masyarakat turun skrg ini ko bisa malah naikin ppn yg kita tau bahwa hampir semua barang jg kena ppn kaannn. awas aja kalo pajak tuh ga di gunain bener2 buat kepentingan pembangunan bangsa dan n,gaji ga dinaekin ppn naik mulu udah tahu daya beli masyarakat turun skrg ini ko bisa malah naikin ppn yang kita tahu bahwa hampir semua barang jg kena ppn kaannn awas aja kalau pajak tuh ga di gunain bener buat kepentingan pembangunan bangsa dan negara yang korup semoga dapet azab,gaji ga dinaekin ppn naik mulu udah tahu daya beli masyarakat turun skrg ini ko bisa malah naikin ppn yang kita tahu bahwa hampir semua barang jg kena ppn kaannn awas aja kalau pajak tuh ga di gunain bener buat kepentingan pembangunan bangsa dan negara yang korup semoga dapet azab
bchristopherc,bchristopherc,1,Gw masih kesel soal kebijakan PPh yang baru. Segala lemburan THR bonus juga kena PPh cih. Aturan kalo pajak naik bikin kebijakan tuh yang pro-rakyat dong yang bisa dirasain efeknya sama rakyat. Jangan nuntut HAK mulu tapi KEWAJIBAN gak dilaksanakan. CAPEK.,Gw masih kesel soal kebijakan PPh yang baru Segala lemburan THR bonus juga kena PPh cih Aturan kalau pajak naik bikin kebijakan tuh yang prorakyat dong yang bisa dirasain efeknya sama rakyat Jangan nuntut HAK mulu tapi KEWAJIBAN tidak dilaksanakan CAPEK,gw masih kesel soal kebijakan pph yang baru segala lemburan thr bonus juga kena pph cih aturan kalau pajak naik bikin kebijakan tuh yang prorakyat dong yang bisa dirasain efeknya sama rakyat jangan nuntut hak mulu tapi kewajiban tidak dilaksanakan capek
robinmanggala92,ardisatriawan,1,@ardisatriawan Pajak naik...kalo pemberantasan korupsi gas gasan gapapa plus hukum tegak lurus. Kalo 2 poin itu melempem ya rakyat berhak misuh.Bajingan,Pajak naikkalo pemberantasan korupsi gas gasan gapapa plus hukum tegak lurus Kalo poin itu melempem ya rakyat berhak misuhBajingan,pajak naikkalo pemberantasan korupsi gas gasan gapapa plus hukum tegak lurus kalo poin itu melempem ya rakyat berhak misuhbajingan
uhatuka,uhatuka,1,pajak naik tapi apbn buat kesehatan sama pendidikan masih rendah dibanding bagian lain halah,pajak naik tapi apbn buat kesehatan sama pendidikan masih rendah dibanding bagian lain halah,pajak naik tapi apbn buat kesehatan sama pendidikan masih rendah dibanding bagian lain halah
ranaohnara,,1,Ya Allah pokoknya aku ga ridho pajak yg udh disetor ke negara ga sampai ke rakyat dn malah dimakan para koruptor. Pokoknya kalo ga lihat azab mereka di dunia aku tunggu azab mreka yg paling pedih di akhirat sehat2 para pekerja tahun depan ppn dah naik.,Ya Allah pokoknya aku ga ridho pajak yang udh disetor ke negara ga sampai ke rakyat dn malah dimakan para koruptor Pokoknya kalau ga lihat azab mereka di dunia aku tunggu azab mreka yang paling pedih di akhirat sehat para pekerja tahun depan ppn dah naik,ya allah pokoknya aku ga ridho pajak yang udh disetor ke negara ga sampai ke rakyat dn malah dimakan para koruptor pokoknya kalau ga lihat azab mereka di dunia aku tunggu azab mreka yang paling pedih di akhirat sehat para pekerja tahun depan ppn dah naik
ZulvikarLukman,,1,Gila daya beli lagi turun turunnya pajak naik lagi stress,Gila daya beli lagi turun turunnya pajak naik lagi stress,gila daya beli lagi turun turunnya pajak naik lagi stress
Ekaputriyulia,,1,UMR naikin juga dong Pak/Bu. Jangan pajak doang yang naik mulu,UMR naikin juga dong PakBu Jangan pajak doang yang naik mulu,umr naikin juga dong pakbu jangan pajak doang yang naik mulu
legopinks,kumparan,2,@kumparan kali kali umr/gaji kek yg dinaikin pajak mulu yg naik,kali kali umrgaji kek yang dinaikin pajak mulu yang naik,kali kali umrgaji kek yang dinaikin pajak mulu yang naik
Impulsicivity,,1,AGI ASI : Kalau gak bisa ngatur keuangan mending cabut aja dari negara gausah nyusahin negara makin banyak hutang sama aturan di tambah pajak makin naik makin susah pajak makin naik hutang makin naik pake otak sebelum bertindak dan berpikir.,AGI ASI Kalau tidak bisa ngatur keuangan mending cabut aja dari negara gausah nyusahin negara makin banyak hutang sama aturan di tambah pajak makin naik makin susah pajak makin naik hutang makin naik pake otak sebelum bertindak dan berpikir,agi asi kalau tidak bisa ngatur keuangan mending cabut aja dari negara gausah nyusahin negara makin banyak hutang sama aturan di tambah pajak makin naik makin susah pajak makin naik hutang makin naik pake otak sebelum bertindak dan berpikir
walltz_,,1,daya beli lg turun pajak naik sepersen. keren kt gw mah,daya beli lg turun pajak naik sepersen keren kt gw mah,daya beli lg turun pajak naik sepersen keren kt gw mah
aknmnzzz,stradifairuz,1,@stradifairuz stress gaji kecil tapi pajak naik mulu bukan makin maju malah makin melarat wkwkw,stress gaji kecil tapi pajak naik mulu bukan makin maju malah makin melarat wkwkw,stress gaji kecil tapi pajak naik mulu bukan makin maju malah makin melarat wkwkw
pjmlyf,_artemins,1,@_artemins pajak naik tapera udah mulai ada ancang ini itu naik apa kena charge/pajak. ril mending duitnya buat bayar cokipop aja ï¸,pajak naik tapera udah mulai ada ancang ini itu naik apa kena chargepajak ril mending duitnya buat bayar cokipop aja,pajak naik tapera udah mulai ada ancang ini itu naik apa kena chargepajak ril mending duitnya buat bayar cokipop aja
idnafierazihder,,1,Menurut kalian kenapa anggaran belanja dipotong 50% tapi pajak naik?,Menurut kalian kenapa anggaran belanja dipotong tapi pajak naik,menurut kalian kenapa anggaran belanja dipotong tapi pajak naik
samoyedgang,,1,pajak mulu yang naik tp kualitas hidup warganya kaga naik2 HAHAHAH. Tebak negara yg ga worth it ditempatin,pajak mulu yang naik tp kualitas hidup warganya kaga naik HAHAHAH Tebak negara yang ga worth it ditempatin,pajak mulu yang naik tp kualitas hidup warganya kaga naik hahahah tebak negara yang ga worth it ditempatin
hayamaranthine,,1,blm dapet fix income tpi pajak udh naik lagi aja nih ohh so cruel to be Indonesian,blm dapet fix income tpi pajak udh naik lagi aja nih ohh so cruel to be Indonesian,blm dapet fix income tpi pajak udh naik lagi aja nih ohh so cruel to be indonesian
wolcverine,,1,Keluarga middle class adalah yang pertama merasakan dampak pajak ini. Biaya hidup makin naik tapi gaji gitu-gitu aja. Nangis. Ya Allah. Buat nabung aja susah makin ke sini. Jancok pemerintah.,Keluarga middle class adalah yang pertama merasakan dampak pajak ini Biaya hidup makin naik tapi gaji gitugitu aja Nangis Ya Allah Buat nabung aja susah makin ke sini Jancok pemerintah,keluarga middle class adalah yang pertama merasakan dampak pajak ini biaya hidup makin naik tapi gaji gitugitu aja nangis ya allah buat nabung aja susah makin ke sini jancok pemerintah
Ginakyo2,kumparan,1,@kumparan Kata pendukung Mulyono dan fufuffaa ...klu bisa naik LG pajak nya JD 17% ..biar PD KOIT semua nya ...blm kebijakan2 lain nya yg akan mereka naikkan ..BAJITOL,Kata pendukung Mulyono dan fufuffaa klu bisa naik LG pajak nya JD biar PD KOIT semua nya blm kebijakan lain nya yang akan mereka naikkan BAJITOL,kata pendukung mulyono dan fufuffaa klu bisa naik lg pajak nya jd biar pd koit semua nya blm kebijakan lain nya yang akan mereka naikkan bajitol
dyonda12,dyonda12,1,cari duit skrg susah pajak malah naik... miris bgt,cari duit skrg susah pajak malah naik miris bgt,cari duit skrg susah pajak malah naik miris bgt
ghzimt,HandiniMartina,1,@HandiniMartina @Berlianpov @Joeamirzzz @ernestprakasa pajak naik segala macam di pajakin terus mentrinya koar mengentaskan kemiskinan padahal ciptain kemiskinan baru dari turunya kelas menengah ke bawah,pajak naik segala macam di pajakin terus mentrinya koar mengentaskan kemiskinan padahal ciptain kemiskinan baru dari turunya kelas menengah ke bawah,pajak naik segala macam di pajakin terus mentrinya koar mengentaskan kemiskinan padahal ciptain kemiskinan baru dari turunya kelas menengah ke bawah
fioreeentina,txtdrimedia,1,@txtdrimedia Pajak naik tp infrastruktur gitu2 aja,Pajak naik tp infrastruktur gitu aja,pajak naik tp infrastruktur gitu aja
mimimooniest,rendezvousrain,1,@rendezvousrain gaji ga naik tp pajak naik,gaji ga naik tp pajak naik,gaji ga naik tp pajak naik
twitsipekerja,ernestprakasa,1,@ernestprakasa Bahkan lebih baik lagi.... BAHKAN GALI KUBUR AJA BAYAR! Gw mau tau ky' apa nasib Indonesia ...gk jauh2....3 bln ke depan aja apakah banyak yg penyakitan krn depresi penghasilan berkurang trus krn pajak naik sampai akhirnya angka bunuh diri,Bahkan lebih baik lagi BAHKAN GALI KUBUR AJA BAYAR Gw mau tahu ky apa nasib Indonesia gk jauh bln ke depan aja apakah banyak yang penyakitan krn depresi penghasilan berkurang trus krn pajak naik sampai akhirnya angka bunuh diri naik di ID,bahkan lebih baik lagi bahkan gali kubur aja bayar gw mau tahu ky apa nasib indonesia gk jauh bln ke depan aja apakah banyak yang penyakitan krn depresi penghasilan berkurang trus krn pajak naik sampai akhirnya angka bunuh diri naik di id
marimellorinee,,1,URGENSI PAJAK NAIK BUAT PRIORITASIN APA????????????????? INFRASTRUKTUR MY ASSSSSSSS JALAN UMUM MASIH JELEK AKSES TRANSUM BUSUK SEGALA BIROKRASI MASIH RUWET SEKOLAH NEGERI MASIH DIPUNGUT BIAYA TRUS PAJAK NAIK BUAT BAYAR APA?????,URGENSI PAJAK NAIK BUAT PRIORITASIN APA INFRASTRUKTUR MY ASSSSSSSS JALAN UMUM MASIH JELEK AKSES TRANSUM BUSUK SEGALA BIROKRASI MASIH RUWET SEKOLAH NEGERI MASIH DIPUNGUT BIAYA TRUS PAJAK NAIK BUAT BAYAR APA,urgensi pajak naik buat prioritasin apa infrastruktur my assssssss jalan umum masih jelek akses transum busuk segala birokrasi masih ruwet sekolah negeri masih dipungut biaya trus pajak naik buat bayar apa
