user,target,sentiment label,full_text,cleaning_cleaned        ,case_folding
Jjakgoongie,,1,I might be dumb tp ya kalo gaji yg sekecil itu dipotong terus blum lagi pajak yg selalu naik ya gimana mau jajan jajan kalo kebutuhan primer aja dah sulit,I might be dumb tp ya kalau gaji yang sekecil itu dipotong terus blum lagi pajak yang selalu naik ya gimana mau jajan jajan kalau kebutuhan primer aja dah sulit,i might be dumb tp ya kalau gaji yang sekecil itu dipotong terus blum lagi pajak yang selalu naik ya gimana mau jajan jajan kalau kebutuhan primer aja dah sulit
perfectkilljoyy,falla_adinda,1,@falla_adinda Hmm karena tahun depan pajak naik otomatis belajar ngefrugal biar nggak kaget.,Hmm karena tahun depan pajak naik otomatis belajar ngefrugal biar nggak kaget,hmm karena tahun depan pajak naik otomatis belajar ngefrugal biar nggak kaget
CokiePramuka,,1,Logika sederhana Uang masyarakat lari ke pinjol dan judol yg triliunan tiap bulan Masyarakat nahan belanja yg ga perlu belanja hanya kebutuhan pokok Bensin naik PPn naik Pajak naik Uang mending buat jaga jaga drpd belanja yg ga perlu,Logika sederhana Uang masyarakat lari ke pinjol dan judol yang triliunan tiap bulan Masyarakat nahan belanja yang ga perlu belanja hanya kebutuhan pokok Bensin naik PPn naik Pajak naik Uang mending buat jaga jaga drpd belanja yang ga perlu,logika sederhana uang masyarakat lari ke pinjol dan judol yang triliunan tiap bulan masyarakat nahan belanja yang ga perlu belanja hanya kebutuhan pokok bensin naik ppn naik pajak naik uang mending buat jaga jaga drpd belanja yang ga perlu
eky_muharrahman,TheX9109,0,@TheX9109 @Yepoi1Yepoi @Strategi_Bisnis Lah Ekonomi negara itu ya GDP kalau ekonomi penduduk baru GDP percapita. Tapi oke lah gdp percapita Indonesia ditahun 2014 itu 3.476 USD sekarang sudah 4.469 USD. Artinya sudah naik 35%. Apakah kenaikan pajak Indone,Lah Ekonomi negara itu ya GDP kalau ekonomi penduduk baru GDP percapita Tapi oke lah gdp percapita Indonesia ditahun itu USD sekarang sudah USD Artinya sudah naik Apakah kenaikan pajak Indonesia mencapai,lah ekonomi negara itu ya gdp kalau ekonomi penduduk baru gdp percapita tapi oke lah gdp percapita indonesia ditahun itu usd sekarang sudah usd artinya sudah naik apakah kenaikan pajak indonesia mencapai
sukasukatsuki,falla_adinda,1,@falla_adinda karena pajak naik harga barang ga menentu kadang naik trs ga turun2 gaada perkembangan dri segi gaji jg ya begitu banyak potongan ini itu tapi kebutuhan smakin susah semakin mahal.,karena pajak naik harga barang ga menentu kadang naik trs ga turun gaada perkembangan dri segi gaji jg ya begitu banyak potongan ini itu tapi kebutuhan smakin susah semakin mahal,karena pajak naik harga barang ga menentu kadang naik trs ga turun gaada perkembangan dri segi gaji jg ya begitu banyak potongan ini itu tapi kebutuhan smakin susah semakin mahal
IndoAudit14,falla_adinda,1,@falla_adinda Krn banyak pabrik tutup bikin banyak penduduk hilang penghasilan. Judol menyerap uang masyarakat ke luar negeri bahan baku kita import besar2an bikin uang kita terserap keluar juga potongan dan pajak naik bikin uang didompet makin dikit. Mau,Krn banyak pabrik tutup bikin banyak penduduk hilang penghasilan Judol menyerap uang masyarakat ke luar negeri bahan baku kita import besaran bikin uang kita terserap keluar juga potongan dan pajak naik bikin uang didompet makin dikit Mau belanja Dari mana duitnya,krn banyak pabrik tutup bikin banyak penduduk hilang penghasilan judol menyerap uang masyarakat ke luar negeri bahan baku kita import besaran bikin uang kita terserap keluar juga potongan dan pajak naik bikin uang didompet makin dikit mau belanja dari mana duitnya
McCormickballs,McCormickballs,1,@falla_adinda biasanya beralih bisnis makann makanya skrg lebih banyak penjual dripada pembeli ditambah hrga bahan baku mkin naik pajak makin aneh-aneh potongan buat pekerja pun makin banyak.,biasanya beralih bisnis makann makanya skrg lebih banyak penjual dripada pembeli ditambah hrga bahan baku mkin naik pajak makin anehaneh potongan buat pekerja pun makin banyak,biasanya beralih bisnis makann makanya skrg lebih banyak penjual dripada pembeli ditambah hrga bahan baku mkin naik pajak makin anehaneh potongan buat pekerja pun makin banyak
kemant23,tempodotco,1,@tempodotco Siap2 aja ada kemungkinan pajak naik harga2 makin naik,Siap aja ada kemungkinan pajak naik harga makin naik,siap aja ada kemungkinan pajak naik harga makin naik
aaron_jacson,NenkMonica,1,@NenkMonica @Gerindra @prabowo Utang lagi. Pajak bakal naik lagi. Atau nanti akan dicari cara peras rakyat. Sial bener nih negara.,Utang lagi Pajak bakal naik lagi Atau nanti akan dicari cara peras rakyat Sial bener nih negara,utang lagi pajak bakal naik lagi atau nanti akan dicari cara peras rakyat sial bener nih negara
haraudibarkah,falla_adinda,1,@falla_adinda - gaji tetap - pajak iuran dll naik - harga kebutuhan pokok naik - harga kebutuhan sekunder tersier apa lagi - mau gak mau tabungan dikeluarkan utk kompensasi Jadi singkat cerita gaji dll cuma cukup utk kebutuhan pokok lainya nanti2 dulu.,gaji tetap pajak iuran dll naik harga kebutuhan pokok naik harga kebutuhan sekunder tersier apa lagi mau tidak mau tabungan dikeluarkan untuk kompensasi Jadi singkat cerita gaji dll cuma cukup untuk kebutuhan pokok lainya nanti dulu,gaji tetap pajak iuran dll naik harga kebutuhan pokok naik harga kebutuhan sekunder tersier apa lagi mau tidak mau tabungan dikeluarkan untuk kompensasi jadi singkat cerita gaji dll cuma cukup untuk kebutuhan pokok lainya nanti dulu
kleysei,auliasoebardi,1,@auliasoebardi Pajak naik tapi regulasi gaji tdk naik. Di kantor saya udh dr 2017 tdk ada kenaikan gaji:(,Pajak naik tapi regulasi gaji tdk naik Di kantor saya udh dr tdk ada kenaikan gaji,pajak naik tapi regulasi gaji tdk naik di kantor saya udh dr tdk ada kenaikan gaji
hopeulicious,falla_adinda,1,@falla_adinda UMR minim tp pajak naik semua bahan pangan dll naik. Bahkan konsumen pun mau ngeluarin uang buat side konsume yang nggak primer aja bakal mikir. Contoh aja di DIY UMR cuma 2jt tp harga makanan di kotanya perporsi 10-15k,UMR minim tp pajak naik semua bahan pangan dll naik Bahkan konsumen pun mau ngeluarin uang buat side konsume yang nggak primer aja bakal mikir Contoh aja di DIY UMR cuma jt tp harga makanan di kotanya perporsi k,umr minim tp pajak naik semua bahan pangan dll naik bahkan konsumen pun mau ngeluarin uang buat side konsume yang nggak primer aja bakal mikir contoh aja di diy umr cuma jt tp harga makanan di kotanya perporsi k
bugykoda,,1,Dari dulu udah bilang tuh pedagang yg mengaku UMKM pake alasan usaha kecil menengah untuk menghindari pajak dan gaji karyawan dengan layak. Mereka2 kalau di daerah bisa naik haji dan umrah sekeluarga ngadain hajatan berhari-hari tapi gaji karyawan dibawah UMR.,Dari dulu udah bilang tuh pedagang yang mengaku UMKM pake alasan usaha kecil menengah untuk menghindari pajak dan gaji karyawan dengan layak Mereka kalau di daerah bisa naik haji dan umrah sekeluarga ngadain hajatan berharihari tapi gaji karyawan dibawah UMR,dari dulu udah bilang tuh pedagang yang mengaku umkm pake alasan usaha kecil menengah untuk menghindari pajak dan gaji karyawan dengan layak mereka kalau di daerah bisa naik haji dan umrah sekeluarga ngadain hajatan berharihari tapi gaji karyawan dibawah umr
Suharto91638148,NenkMonica,1,@NenkMonica @Gerindra @prabowo Rasain lu IQ 58 belom2 Uda mo narik utang.. ingat pajak pasti naik ..rakyat susah lagi..waduh jadi negara pengutang dong.makanya pilih perubahan.. nyesel kan..,Rasain lu IQ belom Uda mo narik utang ingat pajak pasti naik rakyat susah lagiwaduh jadi negara pengutang dongmakanya pilih perubahan nyesel kan,rasain lu iq belom uda mo narik utang ingat pajak pasti naik rakyat susah lagiwaduh jadi negara pengutang dongmakanya pilih perubahan nyesel kan
Zabidinir,xquitavee,1,@xquitavee @jokowi Betul Sangat mendalam dan tak terlupakan berhasil membohongi rakyatnya noleh kemana saja sekarang ada korupsi hutang bejibun harga-harga dan pajak naik rakyatnya diperah dengan berbagai iuran Tapera BPJS. Hebat yah?,Betul Sangat mendalam dan tak terlupakan berhasil membohongi rakyatnya noleh kemana saja sekarang ada korupsi hutang bejibun hargaharga dan pajak naik rakyatnya diperah dengan berbagai iuran Tapera BPJS Hebat yah,betul sangat mendalam dan tak terlupakan berhasil membohongi rakyatnya noleh kemana saja sekarang ada korupsi hutang bejibun hargaharga dan pajak naik rakyatnya diperah dengan berbagai iuran tapera bpjs hebat yah
CokiePramuka,,0,PPn naik jd 12% PPn pajak apa bukan,PPn naik jd PPn pajak apa bukan,ppn naik jd ppn pajak apa bukan
cairinbyriri,kayfahaarukku,1,@kayfahaarukku Bener juga ya tunjangan dpr dll makin naik. Sedangkan pajak rakyat dll jadi makin naik juga,Bener juga ya tunjangan dpr dll makin naik Sedangkan pajak rakyat dll jadi makin naik juga,bener juga ya tunjangan dpr dll makin naik sedangkan pajak rakyat dll jadi makin naik juga
ElVino71533385,NenkMonica,1,@NenkMonica Pajak naik gaji pemalas naik saya beli masyarakat turun pinjol menjamur rentenir berkedok koprasi menjamur.. Susah bgt hidup,Pajak naik gaji pemalas naik saya beli masyarakat turun pinjol menjamur rentenir berkedok koprasi menjamur Susah bgt hidup,pajak naik gaji pemalas naik saya beli masyarakat turun pinjol menjamur rentenir berkedok koprasi menjamur susah bgt hidup
raumdeuter45,,1,Kelucuan pemerintahan di jaman ini 1. Dpr dapat tunjangan rumah rakyatnya yang gaji diatas umr disuruh bayar pajak tapera. 2. Biaya krl naik subsidi dikurangin subsidi ev. Padahal yang beli orang2 yang berduit. Katanya suruh naik.kendaraan publik sekarang malah suruh beli mobil,Kelucuan pemerintahan di jaman ini Dpr dapat tunjangan rumah rakyatnya yang gaji diatas umr disuruh bayar pajak tapera Biaya krl naik subsidi dikurangin subsidi ev Padahal yang beli orang yang berduit Katanya suruh naikkendaraan publik sekarang malah suruh beli mobil,kelucuan pemerintahan di jaman ini dpr dapat tunjangan rumah rakyatnya yang gaji diatas umr disuruh bayar pajak tapera biaya krl naik subsidi dikurangin subsidi ev padahal yang beli orang yang berduit katanya suruh naikkendaraan publik sekarang malah suruh beli mobil
rumi_dj,nabiylarisfa,0,@nabiylarisfa @RidhaIntifadha Setahun hari sekolah sekitar 200 lebih dikit. (52 pekan x 5 hari = 260 -(libur naik kelas-lebaran-semester-dll). Angka makan gratis sekitar 250T. Kalo ga bisa mungut pajak Tentu ada yg dikorbankan seperti subsidi BBM bansos a,Setahun hari sekolah sekitar lebih dikit pekan x hari libur naik kelaslebaransemesterdll Angka makan gratis sekitar T Kalo ga bisa mungut pajak Tentu ada yang dikorbankan seperti subsidi BBM bansos atau nambah hutang,setahun hari sekolah sekitar lebih dikit pekan x hari libur naik kelaslebaransemesterdll angka makan gratis sekitar t kalo ga bisa mungut pajak tentu ada yang dikorbankan seperti subsidi bbm bansos atau nambah hutang
yosefikr,txtdrnaktengah_,1,@txtdrnaktengah_ Mana harga sembako naik pajak pun naik :'),Mana harga sembako naik pajak pun naik,mana harga sembako naik pajak pun naik
MRahayuna,auliasoebardi,0,@auliasoebardi Pajak PPN naik?lah ppn kan gak ada hubungannya sama transaksi kecil kecuali belanja disupermarket dll klo lo belanja di pasar atau pedagang kecil gak bkl kena ppn deh,Pajak PPN naiklah ppn kan tidak ada hubungannya sama transaksi kecil kecuali belanja disupermarket dll klo lo belanja di pasar atau pedagang kecil tidak bkl kena ppn deh,pajak ppn naiklah ppn kan tidak ada hubungannya sama transaksi kecil kecuali belanja disupermarket dll klo lo belanja di pasar atau pedagang kecil tidak bkl kena ppn deh
Wishnoex,tempodotco,1,@tempodotco Pajak naik kalau harga2 turun sih gpp. Kemampuan masyarakat turun malah pajaknya ikutan naik.,Pajak naik kalau harga turun sih gpp Kemampuan masyarakat turun malah pajaknya ikutan naik,pajak naik kalau harga turun sih gpp kemampuan masyarakat turun malah pajaknya ikutan naik
shinywolfbear,,0,Pajak Fankit naik 100k dibanding tahun lalu,Pajak Fankit naik k dibanding tahun lalu,pajak fankit naik k dibanding tahun lalu
CokiePramuka,,1,makin shringking ekonomi Jika inflasi naik artinya ekonomi naik dan GDP naik kalau deflasi ? ekonomi indonesia shrinking pak @prabowo batalkan Tapera 3% harus gelontorkan stimulus nih kurangi pajak rakyat dengan naikan batas PTKP ...... tunda penghapusan pertalite tunda,makin shringking ekonomi Jika inflasi naik artinya ekonomi naik dan GDP naik kalau deflasi ekonomi indonesia shrinking pak batalkan Tapera harus gelontorkan stimulus nih kurangi pajak rakyat dengan naikan batas PTKP tunda penghapusan pertalite tunda,makin shringking ekonomi jika inflasi naik artinya ekonomi naik dan gdp naik kalau deflasi ekonomi indonesia shrinking pak batalkan tapera harus gelontorkan stimulus nih kurangi pajak rakyat dengan naikan batas ptkp tunda penghapusan pertalite tunda
iwanse28,gabreealee,1,@gabreealee @cherry_plumy @tanyakanrl Ya adalah...kan mereka yg keluarin kebijakan...contohnya pajak naik...yg bikin orang malas belanja,Ya adalahkan mereka yang keluarin kebijakancontohnya pajak naikyg bikin orang malas belanja,ya adalahkan mereka yang keluarin kebijakancontohnya pajak naikyg bikin orang malas belanja
emildaizzy,StefanAntonio__,1,@StefanAntonio__ Kan emang harus joged dulu baru bisa menang... Orang berkoar2 beribu ide disampaikan beribu riset dipaparkan suara nya tak nyampai 30% toh.. Yang penting makan siang gratis MRT gratis rumah gratis bebas pajak UMR naik.. Pasti bisa 75% pun,Kan emang harus joged dulu baru bisa menang Orang berkoar beribu ide disampaikan beribu riset dipaparkan suara nya tak nyampai toh Yang penting makan siang gratis MRT gratis rumah gratis bebas pajak UMR naik Pasti bisa punya pasti naik punya,kan emang harus joged dulu baru bisa menang orang berkoar beribu ide disampaikan beribu riset dipaparkan suara nya tak nyampai toh yang penting makan siang gratis mrt gratis rumah gratis bebas pajak umr naik pasti bisa punya pasti naik punya
CokiePramuka,,1,Jika inflasi naik artinya ekonomi naik dan GDP naik kalau deflasi ? ekonomi indonesia shrinking pak @prabowo harus gelontorkan stimulus nih kurangi pajak rakyat dengan naikan batas PTKP ...... tunda penghapusan pertalite tunda kenaikan PPn 12% mudah2an tahun depan bisa,Jika inflasi naik artinya ekonomi naik dan GDP naik kalau deflasi ekonomi indonesia shrinking pak harus gelontorkan stimulus nih kurangi pajak rakyat dengan naikan batas PTKP tunda penghapusan pertalite tunda kenaikan PPn mudahan tahun depan bisa,jika inflasi naik artinya ekonomi naik dan gdp naik kalau deflasi ekonomi indonesia shrinking pak harus gelontorkan stimulus nih kurangi pajak rakyat dengan naikan batas ptkp tunda penghapusan pertalite tunda kenaikan ppn mudahan tahun depan bisa
canoonim,,1,tanda inflasi dan pajak naik adalah = harga membership juga naik . ga tau deh taun depan tiket termurah minimal 2 jt kali ya,tanda inflasi dan pajak naik adalah harga membership juga naik ga tahu deh taun depan tiket termurah minimal jt kali ya,tanda inflasi dan pajak naik adalah harga membership juga naik ga tahu deh taun depan tiket termurah minimal jt kali ya
loncengsalju_,shuajagiya,1,@shuajagiya Mana harganya naik belum sama pajak,Mana harganya naik belum sama pajak,mana harganya naik belum sama pajak
Jido0_,fallindeer_,1,@fallindeer_ Jangan lupa pajak konser naik,Jangan lupa pajak konser naik,jangan lupa pajak konser naik
Irenetarigan,yusuf_dumdum,0,@yusuf_dumdum 10 tahun hidup di masa pak jokowi : 1. gampang cari kerja 2. koruptor sudah tobat 3. kasus honorer selesai 4. pajak tambah murah 5. index demokrasi naik 6. pertambangan mineral hasilnya untuk rakyat 7. dll,tahun hidup di masa pak jokowi gampang cari kerja koruptor sudah tobat kasus honorer selesai pajak tambah murah index demokrasi naik pertambangan mineral hasilnya untuk rakyat dll,tahun hidup di masa pak jokowi gampang cari kerja koruptor sudah tobat kasus honorer selesai pajak tambah murah index demokrasi naik pertambangan mineral hasilnya untuk rakyat dll
PilahPilihPilah,Mahatmagandi69,1,@Mahatmagandi69 @shebriana @t_yudehis gua juga bingung akhirnya wkwkww ini udah mau akhir tahun jangan2 pajak bonus tahunan lebuh gede dr kmrin ini juga serem loh wkwkwkwk thn dpn pajak naik 12% sudah pasti tapera 2027? pajak bonus nih masih ngeri2 sedap,gua juga bingung akhirnya wkwkww ini udah mau akhir tahun jangan pajak bonus tahunan lebuh gede dr kmrin ini juga serem loh wkwkwkwk thn dpn pajak naik sudah pasti tapera pajak bonus nih masih ngeri sedap,gua juga bingung akhirnya wkwkww ini udah mau akhir tahun jangan pajak bonus tahunan lebuh gede dr kmrin ini juga serem loh wkwkwkwk thn dpn pajak naik sudah pasti tapera pajak bonus nih masih ngeri sedap
Dinoxxx721,,1,Baru tahu ada negara yg rakyatnya bahagia di dunia klu di negaranya banyak koruptor dan mafia pajak naik di pungut cukai harga pangan naik buat memenuhi kebutuhan hidup se hari susah dll https://t.co/ky8qpTgIL3,Baru tahu ada negara yang rakyatnya bahagia di dunia klu di negaranya banyak koruptor dan mafia pajak naik di pungut cukai harga pangan naik buat memenuhi kebutuhan hidup se hari susah dll,baru tahu ada negara yang rakyatnya bahagia di dunia klu di negaranya banyak koruptor dan mafia pajak naik di pungut cukai harga pangan naik buat memenuhi kebutuhan hidup se hari susah dll
JinNonik,EEnesje23201,1,@EEnesje23201 Betul...skrg saja isi APBN sudah minus mau gk mau rejim yg akan dtg pasti akan berhutang dan hutang lagi. Akibatnya beban rakyat pasti makin berat berupa berbagai macam pajak yg semakin naik juga harga2 sembako yg semakin mahal...,Betulskrg saja isi APBN sudah minus mau gk mau rejim yang akan dtg pasti akan berhutang dan hutang lagi Akibatnya beban rakyat pasti makin berat berupa berbagai macam pajak yang semakin naik juga harga sembako yang semakin mahal,betulskrg saja isi apbn sudah minus mau gk mau rejim yang akan dtg pasti akan berhutang dan hutang lagi akibatnya beban rakyat pasti makin berat berupa berbagai macam pajak yang semakin naik juga harga sembako yang semakin mahal
nanahana0208,,0,#NAME?,pajak naik,pajak naik
Suharto91638148,VIVAcoid,1,@VIVAcoid Klo naik ya nggak nambah utang dong..kan menambah beban pajak rakyat..goblok banget sih..,Klo naik ya nggak nambah utang dongkan menambah beban pajak rakyatgoblok banget sih,klo naik ya nggak nambah utang dongkan menambah beban pajak rakyatgoblok banget sih
aascorbicacid,TELENOVELlZED,2,@TELENOVELlZED harusnya si daniel nanya kamu masih cinta sama aku gak seandainya pajak penghasilanku udah gak 25%? terus andin jawab dengan santai masih soalnya pajak penghasilan lu kan naik jadi 35%.,harusnya si daniel nanya kamu masih cinta sama aku tidak seandainya pajak penghasilanku udah tidak terus andin jawab dengan santai masih soalnya pajak penghasilan lu kan naik jadi,harusnya si daniel nanya kamu masih cinta sama aku tidak seandainya pajak penghasilanku udah tidak terus andin jawab dengan santai masih soalnya pajak penghasilan lu kan naik jadi
txt_RJ,Massthoms,1,@Massthoms @KangManto123 lah wajar kalau rakyat menanyakan sebab utang negara semakin membengkak dan pajak naik jadi menurut lu kita sebagai rakyat diam aja pekok lu,lah wajar kalau rakyat menanyakan sebab utang negara semakin membengkak dan pajak naik jadi menurut lu kita sebagai rakyat diam aja pekok lu,lah wajar kalau rakyat menanyakan sebab utang negara semakin membengkak dan pajak naik jadi menurut lu kita sebagai rakyat diam aja pekok lu
IwanGun96636740,VIVAcoid,1,@VIVAcoid yang naik itu hutang kian meroket harga pangan tinggi tinggi sekali pendapatan rakyat makin rendah terus pajak dinaikkan lagi buat bayar hutang yg segunung itu dimasud ekonomi meroket ya meroket kebawah https://t.co/v0WigtrLWn,yang naik itu hutang kian meroket harga pangan tinggi tinggi sekali pendapatan rakyat makin rendah terus pajak dinaikkan lagi buat bayar hutang yang segunung itu dimasud ekonomi meroket ya meroket kebawah,yang naik itu hutang kian meroket harga pangan tinggi tinggi sekali pendapatan rakyat makin rendah terus pajak dinaikkan lagi buat bayar hutang yang segunung itu dimasud ekonomi meroket ya meroket kebawah
Jakaria_hutama,CakKhum,1,@CakKhum Menuju Indonesia cemas tahun besok dipotong lagi tapera pajak penghasilan naik jadi 12% phk makin banyak.. pemerintah engga pernah mikir ujung ujung nya rakyat yg terus dipalak... Ancur ini Indonesia lama lama..,Menuju Indonesia cemas tahun besok dipotong lagi tapera pajak penghasilan naik jadi phk makin banyak pemerintah engga pernah mikir ujung ujung nya rakyat yang terus dipalak Ancur ini Indonesia lama lama,menuju indonesia cemas tahun besok dipotong lagi tapera pajak penghasilan naik jadi phk makin banyak pemerintah engga pernah mikir ujung ujung nya rakyat yang terus dipalak ancur ini indonesia lama lama
Whyd801,RickyKardjono,1,@RickyKardjono Hasil pajak yg masuk ke negara makin naik dong...kalau gak dimaling...,Hasil pajak yang masuk ke negara makin naik dongkalau tidak dimaling,hasil pajak yang masuk ke negara makin naik dongkalau tidak dimaling
Sigmahalim,Kaum__Jelata,1,@Kaum__Jelata @BANGSAygSUJUD @prabowo @99propaganda @Alie_Fahnoor @are_inismyname @Kimberley_PS08 @gtobing2903 @florieliciouss @Ndons_Back @satriamadang88 @hasanudinsajid @bitCarli77 Menciumi foto adalah tindakan tidak berotak. Emang kalo sdh mencium foto,Menciumi foto adalah tindakan tidak berotak Emang kalau sdh mencium foto pajak yang mrk bayar tidak naik,menciumi foto adalah tindakan tidak berotak emang kalau sdh mencium foto pajak yang mrk bayar tidak naik
DesemberKedua,,1,Pajak naik segalanya tambah mahal,Pajak naik segalanya tambah mahal,pajak naik segalanya tambah mahal
Alfa_Bimas,bank_indonesia,0,@bank_indonesia Optimis rupiah dibawah 10 rb seperti kata jokowi dl Oya optimis menghadapi pajak yg naik jd 12% Mantap Bank Indonesia,Optimis rupiah dibawah rb seperti kata jokowi dl Oya optimis menghadapi pajak yang naik jd Mantap Bank Indonesia,optimis rupiah dibawah rb seperti kata jokowi dl oya optimis menghadapi pajak yang naik jd mantap bank indonesia
bandargelut,ariel_heryanto,1,@ariel_heryanto Kenaikan pajak saya rasa tidak mungkin diusung di dialog ketika pilpres tidak baik untuk popularitas. Tapi pun kalau kita pragmatis bahwa pajak perlu naik saya rasa pemerintah belum bisa meyakinkan kita pajaknya akan dibelanjakan secara bi,Kenaikan pajak saya rasa tidak mungkin diusung di dialog ketika pilpres tidak baik untuk popularitas Tapi pun kalau kita pragmatis bahwa pajak perlu naik saya rasa pemerintah belum bisa meyakinkan kita pajaknya akan dibelanjakan secara bijak dan amanah,kenaikan pajak saya rasa tidak mungkin diusung di dialog ketika pilpres tidak baik untuk popularitas tapi pun kalau kita pragmatis bahwa pajak perlu naik saya rasa pemerintah belum bisa meyakinkan kita pajaknya akan dibelanjakan secara bijak dan amanah
Indi14D49107,TOM5helby,1,@TOM5helby Ppn naik jadi 12% pajak kendaraan bermotor naik 66%... bangsat,Ppn naik jadi pajak kendaraan bermotor naik bangsat,ppn naik jadi pajak kendaraan bermotor naik bangsat
kedondong2288,sungjaehwanie,1,@sungjaehwanie @Roestandy_ @txtdariotomotif Beli sekarang pajak tahun depan juga naik hehe. Pajak naik berlaku untuk motor lama dan baru.,Beli sekarang pajak tahun depan juga naik hehe Pajak naik berlaku untuk motor lama dan baru,beli sekarang pajak tahun depan juga naik hehe pajak naik berlaku untuk motor lama dan baru
aloaloe_hahaha,,2,Kalau Pajak naik skinker juga naik kan ya harganya. Semoga produk LOKAL yg berkualitas ttp stay dan makin kuat di pasar INDO. Dan konsumen Indo makin cerdas bijak dan selektif,Kalau Pajak naik skinker juga naik kan ya harganya Semoga produk LOKAL yang berkualitas ttp stay dan makin kuat di pasar INDO Dan konsumen Indo makin cerdas bijak dan selektif,kalau pajak naik skinker juga naik kan ya harganya semoga produk lokal yang berkualitas ttp stay dan makin kuat di pasar indo dan konsumen indo makin cerdas bijak dan selektif
sandi_wahyudi,txtdrimedia,1,@txtdrimedia Pajak naik apa lagi,Pajak naik apa lagi,pajak naik apa lagi
gtauakukls4__,susipudjiastuti,1,@susipudjiastuti @prabowo Pajak naik segala bahan pokok naik gaji segitu gitu aja daya beli masyarakat makin menurun tamatlahhhhhhh,Pajak naik segala bahan pokok naik gaji segitu gitu aja daya beli masyarakat makin menurun tamatlahhhhhhh,pajak naik segala bahan pokok naik gaji segitu gitu aja daya beli masyarakat makin menurun tamatlahhhhhhh
agent_pin,kompascom,1,@kompascom Kenaikan upah di Indonesia hampir bisa dikatakan tidak berarti krn pasti diikuti kenaikan harga aplg per 1 Jan 2025 semua naik akibat PPN dan Opsen pajak kendaraan bermotor. Selamat deh,Kenaikan upah di Indonesia hampir bisa dikatakan tidak berarti krn pasti diikuti kenaikan harga aplg per Jan semua naik akibat PPN dan Opsen pajak kendaraan bermotor Selamat deh,kenaikan upah di indonesia hampir bisa dikatakan tidak berarti krn pasti diikuti kenaikan harga aplg per jan semua naik akibat ppn dan opsen pajak kendaraan bermotor selamat deh
Fullsun06062000,avin_1485,1,@avin_1485 Emang vinn malah pajak hiburan (karaoke bar club etc) tuh tadinya 25% pas awal tahun ini naik jadi paling kecil 40% dan paling gede 75% orgil banget kann,Emang vinn malah pajak hiburan karaoke bar club etc tuh tadinya pas awal tahun ini naik jadi paling kecil dan paling gede orgil banget kann,emang vinn malah pajak hiburan karaoke bar club etc tuh tadinya pas awal tahun ini naik jadi paling kecil dan paling gede orgil banget kann
