user,target,sentiment label,full_text,cleaning_cleaned        ,case_folding
torang_satu,ARSIPAJA,0,@ARSIPAJA kenaikan pajak sudah diajukan kalo gak salah 2021 atau 2022 dan sudah disahkan untuk naik pada 2025.... siapapun oesidennya pajak naik 12 persen itu pasti naik...,kenaikan pajak sudah diajukan kalau tidak salah atau dan sudah disahkan untuk naik pada siapapun oesidennya pajak naik persen itu pasti naik,kenaikan pajak sudah diajukan kalau tidak salah atau dan sudah disahkan untuk naik pada siapapun oesidennya pajak naik persen itu pasti naik
prokaldotco,,1,Gapensi Tolak Kenaikan PPN 12 Persen: Beban Berat bagi UMKM Konstruksi dan Masyarakat #beritaterkini #pajak #ppn12persen #umkm #gapensi https://t.co/pj2FdGW0SK,Gapensi Tolak Kenaikan PPN Persen Beban Berat bagi UMKM Konstruksi dan Masyarakat beritaterkini pajak ppnpersen umkm gapensi,gapensi tolak kenaikan ppn persen beban berat bagi umkm konstruksi dan masyarakat beritaterkini pajak ppnpersen umkm gapensi
razkaws,,1,yg setujui pajak 12 persen ya komisi 11 dpr 2019-2024 kmaren..tuh gerombolan anak buah emak banteng kok ga nolak? nih kwontol2nya https://t.co/28hPVxVBin cek 2019-2024,yang setujui pajak persen ya komisi dpr kmarentuh gerombolan anak buah emak banteng kok ga nolak nih kwontolnya cek,yang setujui pajak persen ya komisi dpr kmarentuh gerombolan anak buah emak banteng kok ga nolak nih kwontolnya cek
MohSalim299487,Rizkihadi,1,@Rizkihadi 6 40 persen di bagi 12 bulan sama dengan 0 53 persen. Simulasi 5 milyar +0 53 persen 26jt 500rb. Kenyataannya Dapat hasil 24jt berarti sudah di potong pajak 2 5jt. Kalau dapat 24jt berarti per bulan dapat 0 48 persen.,persen di bagi bulan sama dengan persen Simulasi milyar persen jt rb Kenyataannya Dapat hasil jt berarti sudah di potong pajak jt Kalau dapat jt berarti per bulan dapat persen,persen di bagi bulan sama dengan persen simulasi milyar persen jt rb kenyataannya dapat hasil jt berarti sudah di potong pajak jt kalau dapat jt berarti per bulan dapat persen
VIVAcoid,,1,PPN 12 Persen dan Opsen Pajak Ancam Penjualan Mobil ke 500 Ribu Unit https://t.co/p8JMtG48wS,PPN Persen dan Opsen Pajak Ancam Penjualan Mobil ke Ribu Unit,ppn persen dan opsen pajak ancam penjualan mobil ke ribu unit
CNNIDdaily,,0,Apindo Menilai Tax Amnesty atau Pengampunan Pajak Jilid 3 Bisa Menggantikan Rencana Pemerintah untuk Menaikkan Pajak Pertambahan Nilai atau PPN Menjadi 12 Persen pada Awal 2025. https://t.co/ns6OyEQkD6 https://t.co/hH60py2fYc,Apindo Menilai Tax Amnesty atau Pengampunan Pajak Jilid Bisa Menggantikan Rencana Pemerintah untuk Menaikkan Pajak Pertambahan Nilai atau PPN Menjadi Persen pada Awal,apindo menilai tax amnesty atau pengampunan pajak jilid bisa menggantikan rencana pemerintah untuk menaikkan pajak pertambahan nilai atau ppn menjadi persen pada awal
emang_dasar,suparminwinoto,1,@suparminwinoto @sheeqya @Dewa07178568652 @opposite6892 GW TENGOK GAYA TULISAN LU LU AJA MASIH NUMPANG HIDUP SM ORANGTUA MANA FAHAM EFFECT DOMINO KENAIKAN PAJAK 12 PERSEN,GW TENGOK GAYA TULISAN LU LU AJA MASIH NUMPANG HIDUP SM ORANGTUA MANA FAHAM EFFECT DOMINO KENAIKAN PAJAK PERSEN,gw tengok gaya tulisan lu lu aja masih numpang hidup sm orangtua mana faham effect domino kenaikan pajak persen
theiconomic,,1,Pelaku industri multifinance Indonesia mengkhawatirkan dampak kenaikan tarif Pajak Pertambahan Nilai (PPN) dari 11 persen menjadi 12 persen mulai Januari 2025. Selengkapnya https://t.co/DK3ELzpzGX,Pelaku industri multifinance Indonesia mengkhawatirkan dampak kenaikan tarif Pajak Pertambahan Nilai PPN dari persen menjadi persen mulai Januari Selengkapnya,pelaku industri multifinance indonesia mengkhawatirkan dampak kenaikan tarif pajak pertambahan nilai ppn dari persen menjadi persen mulai januari selengkapnya
haeXjun,MrNobody0519,0,@MrNobody0519 @keyistalll @NiaArmiani17 @kegblgnunfaedh Kalau gji guru negeri dr apbd. Nah itu mgkn kenaikan 12% persen pajak buat naikin gaji guru,Kalau gji guru negeri dr apbd Nah itu mgkn kenaikan persen pajak buat naikin gaji guru,kalau gji guru negeri dr apbd nah itu mgkn kenaikan persen pajak buat naikin gaji guru
fauziapaw,,1,terimakaasih dinaa yg sudah merepost ini ayo beli komik gais. ini sebelum pajak naik 12 persen wkwk,terimakaasih dinaa yang sudah merepost ini ayo beli komik gais ini sebelum pajak naik persen wkwk,terimakaasih dinaa yang sudah merepost ini ayo beli komik gais ini sebelum pajak naik persen wkwk
Itooohh,id_fm,1,@id_fm Gegara fm ga jadi rilis thn ni jd kena pajak 12 persen,Gegara fm ga jadi rilis thn ni jd kena pajak persen,gegara fm ga jadi rilis thn ni jd kena pajak persen
walangfighter,softzzzzzzz,1,@softzzzzzzz lah pajak kan ada itu 12 persen hahahaha ...,lah pajak kan ada itu persen hahahaha,lah pajak kan ada itu persen hahahaha
iman_manul,panditfootball,1,@panditfootball 1 persen dimata kita gak kecil bayangkan 2022 kita masih 10 persen artinya dalam 2 tahun naik 2 persen dari 10 % naik ke 12 % itu biar gampang pake hitungan aja Dulu pajak 10% = beli 100rb pajaknya 10rb Skrng pajak 12% = beli 100rb pajakny,persen dimata kita tidak kecil bayangkan kita masih persen artinya dalam tahun naik persen dari naik ke itu biar gampang pake hitungan aja Dulu pajak beli rb pajaknya rb Skrng pajak beli rb pajaknya rb Dr rb jd rb itu,persen dimata kita tidak kecil bayangkan kita masih persen artinya dalam tahun naik persen dari naik ke itu biar gampang pake hitungan aja dulu pajak beli rb pajaknya rb skrng pajak beli rb pajaknya rb dr rb jd rb itu
bangajij,ransunnyrain,1,@ransunnyrain @opposite6892 Setiap pembelian barang apapun yang dapat disentuh dilihat dan dirasakan adalah kena pajak PPN 12 Persen Itu cukup memberatkan rakyat apalagi gaji yang dipotong setahu gue ini gaada hubungannya sama program presiden Prabowo Sub,Setiap pembelian barang apapun yang dapat disentuh dilihat dan dirasakan adalah kena pajak PPN Persen Itu cukup memberatkan rakyat apalagi gaji yang dipotong setahu gue ini gaada hubungannya sama program presiden Prabowo Subianto ya,setiap pembelian barang apapun yang dapat disentuh dilihat dan dirasakan adalah kena pajak ppn persen itu cukup memberatkan rakyat apalagi gaji yang dipotong setahu gue ini gaada hubungannya sama program presiden prabowo subianto ya
kuterculik,,1,Misalnya dengan menaikkan tarif pajak konsumsi atau Pajak Pertambahan Nilai (PPN) dari 11 persen menjadi 12 persen pada 1 Januari 2025 di tengah lesunya kondisi daya beli masyarakat. https://t.co/0JL49cNvcP,Misalnya dengan menaikkan tarif pajak konsumsi atau Pajak Pertambahan Nilai PPN dari persen menjadi persen pada Januari di tengah lesunya kondisi daya beli masyarakat,misalnya dengan menaikkan tarif pajak konsumsi atau pajak pertambahan nilai ppn dari persen menjadi persen pada januari di tengah lesunya kondisi daya beli masyarakat
Beritasatu,,0,Terkait Kenaikan PPN 12 Persen Komisi Informasi Minta Pemerintah Transparan Soal Pajak https://t.co/a8oRHO4CtA,Terkait Kenaikan PPN Persen Komisi Informasi Minta Pemerintah Transparan Soal Pajak,terkait kenaikan ppn persen komisi informasi minta pemerintah transparan soal pajak
Beritasatu,,1,3 Jenis Pajak Ini Belum Tersentuh dalam UU HPP Kenapa Kenaikan PPN 12 Persen yang Jadi Prioritas? https://t.co/7Xrdao7rsG,Jenis Pajak Ini Belum Tersentuh dalam UU HPP Kenapa Kenaikan PPN Persen yang Jadi Prioritas,jenis pajak ini belum tersentuh dalam uu hpp kenapa kenaikan ppn persen yang jadi prioritas
alimustain82639,Hilmi28,1,@Hilmi28 Betul Pak Ustadz sy terkadang juga mikir sy sebagai buruh kena pajak lumayan gede belum nanti tahun depan naik lagi 12 persen,Betul Pak Ustadz sy terkadang juga mikir sy sebagai buruh kena pajak lumayan gede belum nanti tahun depan naik lagi persen,betul pak ustadz sy terkadang juga mikir sy sebagai buruh kena pajak lumayan gede belum nanti tahun depan naik lagi persen
RadioElshinta,,1,Heboh dan ramai menjadi perbincangan dan membuat kekhawatiran masyarakat Komisi Informasi Pusat (KIP) meminta pemerintah sebaiknya mempertimbangkan kembali rencana Pajak Penambahan Nilai (PPN) 12 persen yang akan berlaku pada 1 Januari 2025. Selain tak transparan KIP menilai https://t.co/a28YGTiyyi,Heboh dan ramai menjadi perbincangan dan membuat kekhawatiran masyarakat Komisi Informasi Pusat KIP meminta pemerintah sebaiknya mempertimbangkan kembali rencana Pajak Penambahan Nilai PPN persen yang akan berlaku pada Januari Selain tak transparan KIP menilai,heboh dan ramai menjadi perbincangan dan membuat kekhawatiran masyarakat komisi informasi pusat kip meminta pemerintah sebaiknya mempertimbangkan kembali rencana pajak penambahan nilai ppn persen yang akan berlaku pada januari selain tak transparan kip menilai
kompascom,,1,Komisi Informasi Pusat (KIP) meminta pemerintah mengkaji kembali rencana kenaikan pajak pertambahan nilai (PPN) menjadi 12 persen. //MN #KIP #PPNNaik #Pajak https://t.co/gRVKcgEnsO,Komisi Informasi Pusat KIP meminta pemerintah mengkaji kembali rencana kenaikan pajak pertambahan nilai PPN menjadi persen MN KIP PPNNaik Pajak,komisi informasi pusat kip meminta pemerintah mengkaji kembali rencana kenaikan pajak pertambahan nilai ppn menjadi persen mn kip ppnnaik pajak
VIVAcoid,,1,Viral Logo Garuda Berlatar Biru Kembali Bergema Suarakan Tolak Kenaikan PPN 12 Persen ___ #Vivacoid #Pajak #PPN #Srimulyani https://t.co/Xl82McHF1b,Viral Logo Garuda Berlatar Biru Kembali Bergema Suarakan Tolak Kenaikan PPN Persen Vivacoid Pajak PPN Srimulyani,viral logo garuda berlatar biru kembali bergema suarakan tolak kenaikan ppn persen vivacoid pajak ppn srimulyani
ketikmedia,,0,Ini Daftar Barang Kena PPN 12 Persen Mulai 1 Januari 2025 Berita selengkapnya klik link di bio Sumber: https://t.co/rK3U5xhcxg | Media Kolaborasi Indonesia. https://t.co/eecw7S4Apc #pajak #ketik #ketikmedia #ketikonline #beritaterkini #beritaterbaru #fyp #foryou #foryourpage https://t.co/OUgXXVCuFK,Ini Daftar Barang Kena PPN Persen Mulai Januari Berita selengkapnya klik link di bio Sumber Media Kolaborasi Indonesia pajak ketik ketikmedia ketikonline beritaterkini beritaterbaru fyp foryou foryourpage,ini daftar barang kena ppn persen mulai januari berita selengkapnya klik link di bio sumber media kolaborasi indonesia pajak ketik ketikmedia ketikonline beritaterkini beritaterbaru fyp foryou foryourpage
EkbisNTBcom,,1,REI NTB Minta Rencana Menaikkan Pajak 12 Persen Ditangguhkan https://t.co/VmYjPc7awu via @EkbisNTB.com,REI NTB Minta Rencana Menaikkan Pajak Persen Ditangguhkan via com,rei ntb minta rencana menaikkan pajak persen ditangguhkan via com
kring_pajak,feriyahtp,0,@feriyahtp Hai Kak. Perihal tarif PPN sebesar 12% (dua belas persen) yang mulai berlaku paling lambat pada tanggal 1 Januari 2025 dinyatakan dalam Pasal 7 ayat (1) huruf b UU PPN stdtd UU HPP (UU No 7 Tahun 2021) Kak. Tks*Fina,Hai Kak Perihal tarif PPN sebesar dua belas persen yang mulai berlaku paling lambat pada tanggal Januari dinyatakan dalam Pasal ayat huruf b UU PPN stdtd UU HPP UU No Tahun Kak TksFina,hai kak perihal tarif ppn sebesar dua belas persen yang mulai berlaku paling lambat pada tanggal januari dinyatakan dalam pasal ayat huruf b uu ppn stdtd uu hpp uu no tahun kak tksfina
Abdulahmad2018,,1,Bawa angin segar pajak 12 persen tahun depan dah pasti,Bawa angin segar pajak persen tahun depan dah pasti,bawa angin segar pajak persen tahun depan dah pasti
jaemain,Rugka,1,@Rugka @Mieju Kirain pajak 12 persen jawabannya,Kirain pajak persen jawabannya,kirain pajak persen jawabannya
e100ss,,1,Pengamat Pajak: Daripada Naikkan PPN 12 Persen Pemerintah Lebih Baik Perbaiki Rasio Pajak https://t.co/glNq6qmBxo,Pengamat Pajak Daripada Naikkan PPN Persen Pemerintah Lebih Baik Perbaiki Rasio Pajak,pengamat pajak daripada naikkan ppn persen pemerintah lebih baik perbaiki rasio pajak
jaemain,eenseo,1,@eenseo @jm_dumpacc Katanya boleh aja kak yg ga boleh kan nagih NIK sama nagih pajak 12 persen (maaf nyindir menteri),Katanya boleh aja kak yang ga boleh kan nagih NIK sama nagih pajak persen maaf nyindir menteri,katanya boleh aja kak yang ga boleh kan nagih nik sama nagih pajak persen maaf nyindir menteri
jaemain,sumen,1,@sumen @DREAM7RUE Abis gini main rp ada pajaknya mulai dari pajak 12 persen sampe pajak jadian,Abis gini main rp ada pajaknya mulai dari pajak persen sampe pajak jadian,abis gini main rp ada pajaknya mulai dari pajak persen sampe pajak jadian
prokaldotco,,0,Tahun Depan PPN Naik Jadi 12 Persen Begini Dampaknya yang Mungkin Terjadi #beritaterkini #PPN #pajak https://t.co/mRIUJ9R9TA,Tahun Depan PPN Naik Jadi Persen Begini Dampaknya yang Mungkin Terjadi beritaterkini PPN pajak,tahun depan ppn naik jadi persen begini dampaknya yang mungkin terjadi beritaterkini ppn pajak
baratanewss,,1,Buruh Ancam Mogok Nasional Tolak Kenaikan Tarif Pajak Pertambahan Nilai (PPN) jadi 12 persen pada 2025 https://t.co/BQDqmwk1Nw,Buruh Ancam Mogok Nasional Tolak Kenaikan Tarif Pajak Pertambahan Nilai PPN jadi persen pada,buruh ancam mogok nasional tolak kenaikan tarif pajak pertambahan nilai ppn jadi persen pada
radarjabar_id,,0,Polemik PPN 12 Persen Masih Memanas Ditjen Pajak Buka Suara https://t.co/tgZF9bWNvJ #RadarJabar #PolemikKenaikanPajak #PPN #ppn12persen #DitjenPajak,Polemik PPN Persen Masih Memanas Ditjen Pajak Buka Suara RadarJabar PolemikKenaikanPajak PPN ppnpersen DitjenPajak,polemik ppn persen masih memanas ditjen pajak buka suara radarjabar polemikkenaikanpajak ppn ppnpersen ditjenpajak
Txtfromopini,,1,Stop IKN batalkan pajak 12 persen,Stop IKN batalkan pajak persen,stop ikn batalkan pajak persen
EkbisNTBcom,,1,Pengusaha Hiburan Senggigi Minta Rencana Kenaikan Pajak 12 Persen Ditinjau Ulang https://t.co/HtWkfo7KYn via @EkbisNTB.com,Pengusaha Hiburan Senggigi Minta Rencana Kenaikan Pajak Persen Ditinjau Ulang via com,pengusaha hiburan senggigi minta rencana kenaikan pajak persen ditinjau ulang via com
Duren___,,1,Oalah SERET TOH??.. Baru 76 3 persen -- BIJIKMANE nanti saat Pajak NAEK JADI 12 PERSEN???... . https://t.co/JIbqisIk9j,Oalah SERET TOH Baru persen BIJIKMANE nanti saat Pajak NAEK JADI PERSEN,oalah seret toh baru persen bijikmane nanti saat pajak naek jadi persen
e100ss,,0,#Wawasan Pajak Pertambahan Nilai (PPN) akan naik dari 11 persen jadi 12 persen mulai tahun depan. Kebijakan ini diatur dalam UU Nomor 7 Tahun 2021 tentang Harmonisasi Peraturan Perpajakan. Dalam beleid itu PPN ditetapkan naik jadi 11 persen mulai 2022 dan 12 persen mulai 2025. https://t.co/qfAlLpyUR1,Wawasan Pajak Pertambahan Nilai PPN akan naik dari persen jadi persen mulai tahun depan Kebijakan ini diatur dalam UU Nomor Tahun tentang Harmonisasi Peraturan Perpajakan Dalam beleid itu PPN ditetapkan naik jadi persen mulai dan persen mulai,wawasan pajak pertambahan nilai ppn akan naik dari persen jadi persen mulai tahun depan kebijakan ini diatur dalam uu nomor tahun tentang harmonisasi peraturan perpajakan dalam beleid itu ppn ditetapkan naik jadi persen mulai dan persen mulai
ye_drone,innovacommunity,1,@innovacommunity Sadis ya Orang umum pajaknya dinaikan 12 persen Mobil listrik mahal disubsidi dan pajaknya hanya kayak pajak motor.,Sadis ya Orang umum pajaknya dinaikan persen Mobil listrik mahal disubsidi dan pajaknya hanya kayak pajak motor,sadis ya orang umum pajaknya dinaikan persen mobil listrik mahal disubsidi dan pajaknya hanya kayak pajak motor
rawonpanasku,kegblgnunfaedh,1,@kegblgnunfaedh salah satu alasan srimulyani naikin pajak jadi 12 persen ya ini. Memaksakan sesuatu mimpi yg sebenernya kapasitasnya g sampai segithu. pura pura mampu demi wedding dream padahal dibaliknya https://t.co/GmFisepzfk,salah satu alasan srimulyani naikin pajak jadi persen ya ini Memaksakan sesuatu mimpi yang sebenernya kapasitasnya g sampai segithu pura pura mampu demi wedding dream padahal dibaliknya,salah satu alasan srimulyani naikin pajak jadi persen ya ini memaksakan sesuatu mimpi yang sebenernya kapasitasnya g sampai segithu pura pura mampu demi wedding dream padahal dibaliknya
kumparan,,0,Pemerintah akan mengenakan tarif Pajak Pertambahan Nilai (PPN) sebesar 12 persen paling lambat 1 Januari 2025. Saat ini tarif PPN sebesar 11 persen. Berdasarkan data Organization of Economic Co-operation and Development (OECD) kenaikan tarif PPN di Indonesia jadi 12 persen itu https://t.co/H563QKNxwo,Pemerintah akan mengenakan tarif Pajak Pertambahan Nilai PPN sebesar persen paling lambat Januari Saat ini tarif PPN sebesar persen Berdasarkan data Organization of Economic Cooperation and Development OECD kenaikan tarif PPN di Indonesia jadi persen itu,pemerintah akan mengenakan tarif pajak pertambahan nilai ppn sebesar persen paling lambat januari saat ini tarif ppn sebesar persen berdasarkan data organization of economic cooperation and development oecd kenaikan tarif ppn di indonesia jadi persen itu
papa_loren,,1,DITJEN PAJAK PASTIKAN PPN 12 PERSEN BERLAKU 1 Januari 2025 Selamat menikmati hasil perasan keringat RAKYATMU wahai para pemimpin negeri..!!! https://t.co/eWYpiQFTto,DITJEN PAJAK PASTIKAN PPN PERSEN BERLAKU Januari Selamat menikmati hasil perasan keringat RAKYATMU wahai para pemimpin negeri,ditjen pajak pastikan ppn persen berlaku januari selamat menikmati hasil perasan keringat rakyatmu wahai para pemimpin negeri
siska_kurosaki,,1,Wts: ginjal Buat nanti ppn jadi 12 persen. Udh mah lagi deflasi karena daya beli masyarakat turun ini lagi pajak mau di naekin. Makasih yeh 58%. Kampretos emang.,Wts ginjal Buat nanti ppn jadi persen Udh mah lagi deflasi karena daya beli masyarakat turun ini lagi pajak mau di naekin Makasih yeh Kampretos emang,wts ginjal buat nanti ppn jadi persen udh mah lagi deflasi karena daya beli masyarakat turun ini lagi pajak mau di naekin makasih yeh kampretos emang
SimpleSmart11,sevenworkday,0,@lahsielvin Karena mengambil sudut pandang kenaikan ppn bertahap dari 10% ke 12% --- Sejak 1 April 2022 pemerintah telah menaikkan Pajak Pertambahan Nilai (PPN) dari 10 persen menjadi 11 persen. Kenaikan tarif PPN ini kabarnya akan bertahap sampai 12 pers,Karena mengambil sudut pandang kenaikan ppn bertahap dari ke Sejak April pemerintah telah menaikkan Pajak Pertambahan Nilai PPN dari persen menjadi persen Kenaikan tarif PPN ini kabarnya akan bertahap sampai persen di tahun mendatang,karena mengambil sudut pandang kenaikan ppn bertahap dari ke sejak april pemerintah telah menaikkan pajak pertambahan nilai ppn dari persen menjadi persen kenaikan tarif ppn ini kabarnya akan bertahap sampai persen di tahun mendatang
Jumianto_RK,,1,Udah daya beli masyarakat melemah masih di tekan ama pajak 12 persen. Rakyat di peras buat makan untuk besok aja rakyat masih mikir kadang bisa makan kadang kagak makan. Terus mana yang katanya dari rakyat untuk rakyat yg ada malah dari rakyat buat pejabat dan konglomerat. https://t.co/5WYO94MCyu,Udah daya beli masyarakat melemah masih di tekan ama pajak persen Rakyat di peras buat makan untuk besok aja rakyat masih mikir kadang bisa makan kadang kagak makan Terus mana yang katanya dari rakyat untuk rakyat yang ada malah dari rakyat buat pejabat dan konglomerat,udah daya beli masyarakat melemah masih di tekan ama pajak persen rakyat di peras buat makan untuk besok aja rakyat masih mikir kadang bisa makan kadang kagak makan terus mana yang katanya dari rakyat untuk rakyat yang ada malah dari rakyat buat pejabat dan konglomerat
DaimatuRokhmah,C_D3pp,0,@C_D3pp PBB = wajib dibayar bagi wajib pajak Krn punya tanah/bangunan. PPH pasal ?.: gajine anakku dipotong PPh brp persen yaa? PPN = pajak klo beli barang (mewah?) 12 persen. Beli traktor kena PPN gak ya? Atau beli mesin penghancur plastik kena PPN gak y,PBB wajib dibayar bagi wajib pajak Krn punya tanahbangunan PPH pasal gajine anakku dipotong PPh brp persen yaa PPN pajak klo beli barang mewah persen Beli traktor kena PPN tidak ya Atau beli mesin penghancur plastik kena PPN tidak ya,pbb wajib dibayar bagi wajib pajak krn punya tanahbangunan pph pasal gajine anakku dipotong pph brp persen yaa ppn pajak klo beli barang mewah persen beli traktor kena ppn tidak ya atau beli mesin penghancur plastik kena ppn tidak ya
Mata_Netizen62,,1,Kita Jogetin Aja Ekonomi Sulit Banyak PHK Rakyat Makin Di Di Tekan Dengan Kenaikan Pajak Ditjen Pajak Pastikan PPN 12 Persen Berlaku 1 Januari 2025 Direktorat Jenderal Pajak (Ditjen Pajak) memastikan pemerintah akan mengimplementasi Pajak Pertambahan Nilai (PPN) https://t.co/jwBSqwZlYN,Kita Jogetin Aja Ekonomi Sulit Banyak PHK Rakyat Makin Di Di Tekan Dengan Kenaikan Pajak Ditjen Pajak Pastikan PPN Persen Berlaku Januari Direktorat Jenderal Pajak Ditjen Pajak memastikan pemerintah akan mengimplementasi Pajak Pertambahan Nilai PPN,kita jogetin aja ekonomi sulit banyak phk rakyat makin di di tekan dengan kenaikan pajak ditjen pajak pastikan ppn persen berlaku januari direktorat jenderal pajak ditjen pajak memastikan pemerintah akan mengimplementasi pajak pertambahan nilai ppn
B_dzoel,,1,Nikmati Hasil Pilihan Klen â€¼ï¸ Kekayaan alam nusantara ternyata tak membuat Penguasa berhenti memeras Rakyatnya !! Ditjen Pajak Pastikan PPN 12 Persen Berlaku 1 Januari 2025 https://t.co/q5lqm6BXw5,Nikmati Hasil Pilihan Klen Kekayaan alam nusantara ternyata tak membuat Penguasa berhenti memeras Rakyatnya Ditjen Pajak Pastikan PPN Persen Berlaku Januari,nikmati hasil pilihan klen kekayaan alam nusantara ternyata tak membuat penguasa berhenti memeras rakyatnya ditjen pajak pastikan ppn persen berlaku januari
agarambling,,1,Ga terima aku pajak ppn naik jdi 12 persen bangsat tai anjing pukiiiii,Ga terima aku pajak ppn naik jdi persen bangsat tai anjing pukiiiii,ga terima aku pajak ppn naik jdi persen bangsat tai anjing pukiiiii
kumparan,,0,Ditjen Pajak memastikan PPN 12 persen berlaku 1 Januari 2025. #bisnisupdate #update #bisnis #text https://t.co/kEks2NqhpH,Ditjen Pajak memastikan PPN persen berlaku Januari bisnisupdate update bisnis text,ditjen pajak memastikan ppn persen berlaku januari bisnisupdate update bisnis text
sasaranbina,Diek_Clev,1,@Diek_Clev @ILCTalkshow Kau dapat apa Bela2 Mulyono. Yang ada pajak naik 12 persen begoo semua naik. Selama 10 thn dari pajak 10 11 dan besok 2025 12 persen. Sirkle gua pengusaha. Dan mereka resah. Lu jongos Tau apa. Babu!!,Kau dapat apa Bela Mulyono Yang ada pajak naik persen begoo semua naik Selama thn dari pajak dan besok persen Sirkle gua pengusaha Dan mereka resah Lu jongos Tau apa Babu,kau dapat apa bela mulyono yang ada pajak naik persen begoo semua naik selama thn dari pajak dan besok persen sirkle gua pengusaha dan mereka resah lu jongos tau apa babu
tvOneNews,,0,Prabowo Mau Pangkas PPh Badan Jadi 20 Persen Tapi Harap Tax Ratio Naik Mungkinkah?: Rencana penurunan PPh badan itu muncul di tengah keinginan pemerintah Prabowo-Gibran meningkatkan rasio pajak (tax ratio) dari 12 persen menjadi 23 persen. https://t.co/9KFc0RORbR https://t.co/T6IT2JL4Yq,Prabowo Mau Pangkas PPh Badan Jadi Persen Tapi Harap Tax Ratio Naik Mungkinkah Rencana penurunan PPh badan itu muncul di tengah keinginan pemerintah PrabowoGibran meningkatkan rasio pajak tax ratio dari persen menjadi persen,prabowo mau pangkas pph badan jadi persen tapi harap tax ratio naik mungkinkah rencana penurunan pph badan itu muncul di tengah keinginan pemerintah prabowogibran meningkatkan rasio pajak tax ratio dari persen menjadi persen
inilahdotcom,,1,Banyak ekonom memberikan masukan kepada pemerintahan baru yang bakal dipimpin Prabowo Subianto. Tunda kenaikan pajak pertambahan nilai (PPN) 12 persen... https://t.co/kR6ALXRFx3,Banyak ekonom memberikan masukan kepada pemerintahan baru yang bakal dipimpin Prabowo Subianto Tunda kenaikan pajak pertambahan nilai PPN persen,banyak ekonom memberikan masukan kepada pemerintahan baru yang bakal dipimpin prabowo subianto tunda kenaikan pajak pertambahan nilai ppn persen
tempodotco,,1,Orang Dekat Prabowo Sebut Kenaikan PPN 12 Persen Justru Bisa Turunkan Penerimaan Pajak https://t.co/U7xPaI2gA9 #TempoBisnis,Orang Dekat Prabowo Sebut Kenaikan PPN Persen Justru Bisa Turunkan Penerimaan Pajak TempoBisnis,orang dekat prabowo sebut kenaikan ppn persen justru bisa turunkan penerimaan pajak tempobisnis
keuangan_,,1,Ekonom sekaligus Anggota Dewan Pakar TKN Prabowo-Gibran Dradjad Wibowo tidak setuju jika pajak pertambahan nilai (PPN) naik menjadi 12 persen. Dia khawatir kenaikan PPN tersebut berdampak negatif terhadap penerimaan pajak. https://t.co/1UTz6dfYp4 @AidilAKBAR,Ekonom sekaligus Anggota Dewan Pakar TKN PrabowoGibran Dradjad Wibowo tidak setuju jika pajak pertambahan nilai PPN naik menjadi persen Dia khawatir kenaikan PPN tersebut berdampak negatif terhadap penerimaan pajak,ekonom sekaligus anggota dewan pakar tkn prabowogibran dradjad wibowo tidak setuju jika pajak pertambahan nilai ppn naik menjadi persen dia khawatir kenaikan ppn tersebut berdampak negatif terhadap penerimaan pajak
sasaranbina,dwioktariyadi,1,@dwioktariyadi @UntheeUnti Bukan Masalah Ijazah aja. Tapi lu lu pada belain orang kek gini. https://t.co/3JnIsbio3f Hutang bengkak hukum amburadul korupsi meraja lela pajak dulu 10 naik jadi 11 thn dpn naik jadi 12 persen. Kalo lu lu pencinta Mulyono gak,Bukan Masalah Ijazah aja Tapi lu lu pada belain orang kek gini Hutang bengkak hukum amburadul korupsi meraja lela pajak dulu naik jadi thn dpn naik jadi persen Kalo lu lu pencinta Mulyono tidak tobat Artinya kalian emang kagak waras,bukan masalah ijazah aja tapi lu lu pada belain orang kek gini hutang bengkak hukum amburadul korupsi meraja lela pajak dulu naik jadi thn dpn naik jadi persen kalo lu lu pencinta mulyono tidak tobat artinya kalian emang kagak waras
chiensugianto,,1,Nampak nya si hampir 80% thomas djiwandono jadi menkeu nya kabinet prabowo Harapan nya ppn 12 persen di tunda dan bisa menyederhanakan pajak,Nampak nya si hampir thomas djiwandono jadi menkeu nya kabinet prabowo Harapan nya ppn persen di tunda dan bisa menyederhanakan pajak,nampak nya si hampir thomas djiwandono jadi menkeu nya kabinet prabowo harapan nya ppn persen di tunda dan bisa menyederhanakan pajak
