user,target,sentiment label,full_text,cleaning_cleaned        ,case_folding
prasilviat82682,PreciosaKanti,1,@PreciosaKanti Atur sajalah . Negara ini toh milik kalian . Biar sajah Rakyat mah di cekik aturanbdan pajak ppn 12 persen . Biar sajah rakyat mah yg penting bayar pajak agar bisa membayar kalian para bandot kekuasaan !!!!!!!,Atur sajalah Negara ini toh milik kalian Biar sajah Rakyat mah di cekik aturanbdan pajak ppn persen Biar sajah rakyat mah yang penting bayar pajak agar bisa membayar kalian para bandot kekuasaan,atur sajalah negara ini toh milik kalian biar sajah rakyat mah di cekik aturanbdan pajak ppn persen biar sajah rakyat mah yang penting bayar pajak agar bisa membayar kalian para bandot kekuasaan
IconMan17,,0,Sri Mulyani akan tetap menerapkan tarif Pajak Pertambahan Nilai (PPN) 12 persen pada 1 Januari 2025. https://t.co/yjIv5sarwa,Sri Mulyani akan tetap menerapkan tarif Pajak Pertambahan Nilai PPN persen pada Januari,sri mulyani akan tetap menerapkan tarif pajak pertambahan nilai ppn persen pada januari
070Wid,,1,Pajak hanya untuk rakyat. Pengusaha yang dapat pemutihan Pajak dan penikmat pajak di PSN. Penjualan Mobil Terancam Lesu Lagi karena PPN 12 Persen pada 2025 https://t.co/A1XZ1WzWui,Pajak hanya untuk rakyat Pengusaha yang dapat pemutihan Pajak dan penikmat pajak di PSN Penjualan Mobil Terancam Lesu Lagi karena PPN Persen pada,pajak hanya untuk rakyat pengusaha yang dapat pemutihan pajak dan penikmat pajak di psn penjualan mobil terancam lesu lagi karena ppn persen pada
Duren___,Bryan_MyBoyx,1,@Bryan_MyBoyx Nyang kost mah tiap bulan dibayar ma ortu lewat kiriman.. Kalo Nyang enniihh???... THN depan pajak 12 persen.. blm yg lainnya..,Nyang kost mah tiap bulan dibayar ma ortu lewat kiriman Kalo Nyang enniihh THN depan pajak persen blm yang lainnya,nyang kost mah tiap bulan dibayar ma ortu lewat kiriman kalo nyang enniihh thn depan pajak persen blm yang lainnya
BryokAceh,cnbcindonesia,1,@cnbcindonesia Selamat buat 58 % yg telah memilih keberlanjutan Pajak Rakyat kecil naik 12 % tapi Pajak Penguasa Importir BEBAS NOL PERSEN.,Selamat buat yang telah memilih keberlanjutan Pajak Rakyat kecil naik tapi Pajak Penguasa Importir BEBAS NOL PERSEN,selamat buat yang telah memilih keberlanjutan pajak rakyat kecil naik tapi pajak penguasa importir bebas nol persen
sasaranbina,arkaatmaja7,1,@arkaatmaja7 @msaid_didu Penjilat Mulyono Go Blog. Lu 2025 bakal kaing2 kena pajak 12 persen. Mending lu tobat dari sekarang Bol DobOl. Hentikan menjilat Mulyono Bollll.,Penjilat Mulyono Go Blog Lu bakal kaing kena pajak persen Mending lu tobat dari sekarang Bol DobOl Hentikan menjilat Mulyono Bollll,penjilat mulyono go blog lu bakal kaing kena pajak persen mending lu tobat dari sekarang bol dobol hentikan menjilat mulyono bollll
andrikosasi,Puthutea,1,@Puthutea Royalti buku 10 persen Pajak Pertambahan Nilai 11(+1%).. wkwkwk g ngapa2in dapat 12 persen yg bikin cuma 10%..,Royalti buku persen Pajak Pertambahan Nilai wkwkwk g ngapain dapat persen yang bikin cuma,royalti buku persen pajak pertambahan nilai wkwkwk g ngapain dapat persen yang bikin cuma
pajakcom,,0,Survei KedaiKOPI: 83 2% Responden Jabodetabek Menolak Wacana Kenaikan PPN 12 Persen https://t.co/mByFDOmEFB,Survei KedaiKOPI Responden Jabodetabek Menolak Wacana Kenaikan PPN Persen,survei kedaikopi responden jabodetabek menolak wacana kenaikan ppn persen
Fortune_IDN,,0,Apa Efek jika Pajak Naik Menjadi 12 Persen? Ini Dampaknya https://t.co/kztJa68NHp,Apa Efek jika Pajak Naik Menjadi Persen Ini Dampaknya,apa efek jika pajak naik menjadi persen ini dampaknya
KedaiPenaCom,,0,Menko Perekonomian Belum Bisa Memastikan Penerapan Kenaikan Pajak Menjadi 12 Persen via @kedaipenacom https://t.co/0Y9f9MQaTI,Menko Perekonomian Belum Bisa Memastikan Penerapan Kenaikan Pajak Menjadi Persen via,menko perekonomian belum bisa memastikan penerapan kenaikan pajak menjadi persen via
rintikmantra,dimitology,1,@dimitology DIPOTONG PAJAK 12 persen ia?,DIPOTONG PAJAK persen ia,dipotong pajak persen ia
sasaranbina,itsquaileggs,1,@itsquaileggs Wahai pembela Mulyono tahun depan pajak 12 persen. Hidup lu keluarga lu temen2 lu sodara lu makin susah ntar.. Masih aja puja puji. Beg hoo atau Gmn sih tuh Ngotak kagak dipake mikir apa. Udah nyusahin masih di bela.,Wahai pembela Mulyono tahun depan pajak persen Hidup lu keluarga lu temen lu sodara lu makin susah ntar Masih aja puja puji Beg hoo atau Gmn sih tuh Ngotak kagak dipake mikir apa Udah nyusahin masih di bela,wahai pembela mulyono tahun depan pajak persen hidup lu keluarga lu temen lu sodara lu makin susah ntar masih aja puja puji beg hoo atau gmn sih tuh ngotak kagak dipake mikir apa udah nyusahin masih di bela
Harian_Jogja,,0,Penjualan Mobil Meningkat Jelang Kenaikan PPN Jadi 12 Persen dan Berlakunya Opsen Pajak https://t.co/krOC7mDsWs https://t.co/n0uCpIrkHS,Penjualan Mobil Meningkat Jelang Kenaikan PPN Jadi Persen dan Berlakunya Opsen Pajak,penjualan mobil meningkat jelang kenaikan ppn jadi persen dan berlakunya opsen pajak
VIVAcoid,,2,Wakil Ketua Komisi XI DPR RI Hanif Dhakiri angkat bicara soal wacana pemerintah menaikkan Pajak Pertambahan Nilai (PPN) sebesar 12 persen. Dia menyebut menaikkan PPN merupakan cara paling mudah untuk meningkatkan pendapatan negara. Hal itu disampaikan Hanif dalam diskusi https://t.co/yhylkXijsV,Wakil Ketua Komisi XI DPR RI Hanif Dhakiri angkat bicara soal wacana pemerintah menaikkan Pajak Pertambahan Nilai PPN sebesar persen Dia menyebut menaikkan PPN merupakan cara paling mudah untuk meningkatkan pendapatan negara Hal itu disampaikan Hanif dalam diskusi,wakil ketua komisi xi dpr ri hanif dhakiri angkat bicara soal wacana pemerintah menaikkan pajak pertambahan nilai ppn sebesar persen dia menyebut menaikkan ppn merupakan cara paling mudah untuk meningkatkan pendapatan negara hal itu disampaikan hanif dalam diskusi
RadioElshinta,,0,Wakil Ketua Komisi XI DPR RI Hanif Dhakiri menyebut wacana kenaikan Pajak Pertambahan Nilai (PPN) 12 persen dapat menghasilkan tambahan pendapatan negara dari Rp 70 hingga 80 triliun Sabtu (14/12). Ard #BeritaElshinta https://t.co/C13AZbF6R3,Wakil Ketua Komisi XI DPR RI Hanif Dhakiri menyebut wacana kenaikan Pajak Pertambahan Nilai PPN persen dapat menghasilkan tambahan pendapatan negara dari Rp hingga triliun Sabtu Ard BeritaElshinta,wakil ketua komisi xi dpr ri hanif dhakiri menyebut wacana kenaikan pajak pertambahan nilai ppn persen dapat menghasilkan tambahan pendapatan negara dari rp hingga triliun sabtu ard beritaelshinta
Ag99_LFC,kpgnj,1,@kpgnj @BudiBukanIntel Makanya boikot pajak 12 persen,Makanya boikot pajak persen,makanya boikot pajak persen
Duren___,,1,NASEBB Rakyat Jelata Pajak dinaikkan 12 persen Lingkungan diberi Narapidana -- Yg bebas duluan Koruptor keknya https://t.co/BVR11T7QkJ,NASEBB Rakyat Jelata Pajak dinaikkan persen Lingkungan diberi Narapidana Yg bebas duluan Koruptor keknya,nasebb rakyat jelata pajak dinaikkan persen lingkungan diberi narapidana yg bebas duluan koruptor keknya
korbandinasti,kompascom,1,@kompascom Ngapain diberitakan KOMPAS??? Gausah diberitakan lah kilah an Airlangga. Orang berkilah dan ngeles kok di beritakan. Cukup berhenti di PPN naik jadi 12 persen menjadi fakta final. sedangkan Vietnam yang nilai tukarnya dibawah kita justru menuru,Ngapain diberitakan KOMPAS Gausah diberitakan lah kilah an Airlangga Orang berkilah dan ngeles kok di beritakan Cukup berhenti di PPN naik jadi persen menjadi fakta final sedangkan Vietnam yang nilai tukarnya dibawah kita justru menurunkan ppn Disetir kok keterusan,ngapain diberitakan kompas gausah diberitakan lah kilah an airlangga orang berkilah dan ngeles kok di beritakan cukup berhenti di ppn naik jadi persen menjadi fakta final sedangkan vietnam yang nilai tukarnya dibawah kita justru menurunkan ppn disetir kok keterusan
nusabalicom,,0,Menteri Koordinator Bidang Perekonomian Airlangga Hartarto menyebut bahwa detail terkait pemberlakuan Pajak Pertambahan Nilai (PPN) 12 persen dan paket kebijakan ekonomi akan diumumkan Senin (16/12) depan. https://t.co/YgpOV5YvFl,Menteri Koordinator Bidang Perekonomian Airlangga Hartarto menyebut bahwa detail terkait pemberlakuan Pajak Pertambahan Nilai PPN persen dan paket kebijakan ekonomi akan diumumkan Senin depan,menteri koordinator bidang perekonomian airlangga hartarto menyebut bahwa detail terkait pemberlakuan pajak pertambahan nilai ppn persen dan paket kebijakan ekonomi akan diumumkan senin depan
RadioElshinta,,1,Pajak Pertambahan Nilai atau PPN yang naik menjadi 12 persen di 2025 masih menuai sorotan. Terlebih salah satu negara tetangga yakni Vietnam justru memperpanjang penurunan tarif pajak pertambahan nilai (PPN) dari awalnya 10 persen turun jadi 8 persen. Meskipun setiap negara https://t.co/N1DBKSow21,Pajak Pertambahan Nilai atau PPN yang naik menjadi persen di masih menuai sorotan Terlebih salah satu negara tetangga yakni Vietnam justru memperpanjang penurunan tarif pajak pertambahan nilai PPN dari awalnya persen turun jadi persen Meskipun setiap negara,pajak pertambahan nilai atau ppn yang naik menjadi persen di masih menuai sorotan terlebih salah satu negara tetangga yakni vietnam justru memperpanjang penurunan tarif pajak pertambahan nilai ppn dari awalnya persen turun jadi persen meskipun setiap negara
SilviaA96,dicky_novera,2,@dicky_novera Dengan tarif PPN 12 persen pemerintah dapat mengoptimalkan penerimaan pajak.,Dengan tarif PPN persen pemerintah dapat mengoptimalkan penerimaan pajak,dengan tarif ppn persen pemerintah dapat mengoptimalkan penerimaan pajak
SilviaA96,dicky_novera,2,@dicky_novera Penerapan tarif PPN 12 persen adalah upaya untuk menciptakan sistem pajak yang lebih adil.,Penerapan tarif PPN persen adalah upaya untuk menciptakan sistem pajak yang lebih adil,penerapan tarif ppn persen adalah upaya untuk menciptakan sistem pajak yang lebih adil
TaherBayu,hkkri_,1,@hkkri_ @choymarkochoy Apa apa anak Abah Makan tuh pajak 12 persen,Apa apa anak Abah Makan tuh pajak persen,apa apa anak abah makan tuh pajak persen
mrEko_84,idextratime,1,@idextratime Siap siap pajak 12 persen taun depan pajak kendaraan jg naikk,Siap siap pajak persen taun depan pajak kendaraan jg naikk,siap siap pajak persen taun depan pajak kendaraan jg naikk
jaemain,Heeseungd,1,@Heeseungd Emang di bumi ini warga lebih nyari gratis ongkir daripada gratis pajak 12 persen ya,Emang di bumi ini warga lebih nyari gratis ongkir daripada gratis pajak persen ya,emang di bumi ini warga lebih nyari gratis ongkir daripada gratis pajak persen ya
jondivar,,0,Ntr perusahaan otomotif akan menambah pengangguran. Tips Beli Mobil Tanpa Kenaikan Harga Usai PPN 12 Persen dan Opsen Pajak https://t.co/IngNcjUvA6,Ntr perusahaan otomotif akan menambah pengangguran Tips Beli Mobil Tanpa Kenaikan Harga Usai PPN Persen dan Opsen Pajak,ntr perusahaan otomotif akan menambah pengangguran tips beli mobil tanpa kenaikan harga usai ppn persen dan opsen pajak
kompascom,,0,Otoritas Jasa Keuangan (OJK) mengatakan rencana pemerintah menaikkan Pajak Pertumbuhan Nilai (PPN) jadi 12 persen pada Januari 2025 dapat memengaruhi daya beli masyarakat. //MN #OJK #PPN #DayaBeliMasyarakat https://t.co/YoMw2JMEzW,Otoritas Jasa Keuangan OJK mengatakan rencana pemerintah menaikkan Pajak Pertumbuhan Nilai PPN jadi persen pada Januari dapat memengaruhi daya beli masyarakat MN OJK PPN DayaBeliMasyarakat,otoritas jasa keuangan ojk mengatakan rencana pemerintah menaikkan pajak pertumbuhan nilai ppn jadi persen pada januari dapat memengaruhi daya beli masyarakat mn ojk ppn dayabelimasyarakat
tempodotco,,0,Paket Kebijakan Ekonomi Diumumkan Senin Depan Ada soal PPN 12 Persen hingga Insentif Pajak https://t.co/Hw8pVv3aX5,Paket Kebijakan Ekonomi Diumumkan Senin Depan Ada soal PPN Persen hingga Insentif Pajak,paket kebijakan ekonomi diumumkan senin depan ada soal ppn persen hingga insentif pajak
antaranews,,0,Menteri Koordinator Bidang Perekonomian Airlangga Hartarto menyebut bahwa detail terkait pemberlakuan pajak pertambahan nilai (PPN) 12 persen dan paket kebijakan ekonomi akan diumumkan Senin depan. https://t.co/q7IdSPjqTK,Menteri Koordinator Bidang Perekonomian Airlangga Hartarto menyebut bahwa detail terkait pemberlakuan pajak pertambahan nilai PPN persen dan paket kebijakan ekonomi akan diumumkan Senin depan,menteri koordinator bidang perekonomian airlangga hartarto menyebut bahwa detail terkait pemberlakuan pajak pertambahan nilai ppn persen dan paket kebijakan ekonomi akan diumumkan senin depan
KedaiPenaCom,,1,PPN 12 Persen Bukan Solusi Tepat untuk Naikkan Rasio Pajak Hadi Poernomo: Seharusnya Tingkatkan Kepatuhan via @kedaipenacom https://t.co/1vhXOEA32P,PPN Persen Bukan Solusi Tepat untuk Naikkan Rasio Pajak Hadi Poernomo Seharusnya Tingkatkan Kepatuhan via,ppn persen bukan solusi tepat untuk naikkan rasio pajak hadi poernomo seharusnya tingkatkan kepatuhan via
Mulya3173971622,DS_yantie,1,@DS_yantie Mbak Sri pajak 12 persen mohon di naikin lagi.. Yg kaya yg nggak bayar pajak diberi tax amnesty. Enggak usah bingung kami warga kecil sdh biasa hidup susah. Klau kalangan atas dia miskin takut malu,Mbak Sri pajak persen mohon di naikin lagi Yg kaya yang nggak bayar pajak diberi tax amnesty Enggak usah bingung kami warga kecil sdh biasa hidup susah Klau kalangan atas dia miskin takut malu,mbak sri pajak persen mohon di naikin lagi yg kaya yang nggak bayar pajak diberi tax amnesty enggak usah bingung kami warga kecil sdh biasa hidup susah klau kalangan atas dia miskin takut malu
KawalPajakKita,,0,Jakarta CNN Indonesia -- Menteri Keuangan Sri MulyaniÂ tengah menyusun daftar barang yang bakal terkena kenaikan pajak pertambahan nilai (PPN) 12 persen pada pekan depan. https://t.co/xkK6CcF4OG,Jakarta CNN Indonesia Menteri Keuangan Sri Mulyani tengah menyusun daftar barang yang bakal terkena kenaikan pajak pertambahan nilai PPN persen pada pekan depan,jakarta cnn indonesia menteri keuangan sri mulyani tengah menyusun daftar barang yang bakal terkena kenaikan pajak pertambahan nilai ppn persen pada pekan depan
nusabalicom,,0,Menteri Keuangan Sri Mulyani tengah menyusun daftar barang yang bakal terkena kenaikan pajak pertambahan nilai (PPN) 12 persen pada pekan depan. https://t.co/7hnjeVKaes,Menteri Keuangan Sri Mulyani tengah menyusun daftar barang yang bakal terkena kenaikan pajak pertambahan nilai PPN persen pada pekan depan,menteri keuangan sri mulyani tengah menyusun daftar barang yang bakal terkena kenaikan pajak pertambahan nilai ppn persen pada pekan depan
popjasaofficial,,0,Sri Mulyani Umumkan Barang Kena PPN 12 Persen Pekan Depan Sumber : CNN INDONESIA Foto : CNN INDONESIA #ppn12persen #ppn #pajak #barangkenapajak https://t.co/ZlWTbduaPQ,Sri Mulyani Umumkan Barang Kena PPN Persen Pekan Depan Sumber CNN INDONESIA Foto CNN INDONESIA ppnpersen ppn pajak barangkenapajak,sri mulyani umumkan barang kena ppn persen pekan depan sumber cnn indonesia foto cnn indonesia ppnpersen ppn pajak barangkenapajak
erwinmunoz11,msaid_didu,1,@msaid_didu Pak didu suarakan analisa kritis anda di balik naiknya ppn 12 persen sama opsen pajak bermotor pak meresahkan bgt!,Pak didu suarakan analisa kritis anda di balik naiknya ppn persen sama opsen pajak bermotor pak meresahkan bgt,pak didu suarakan analisa kritis anda di balik naiknya ppn persen sama opsen pajak bermotor pak meresahkan bgt
M19Agus,prastow,1,@prastow pak @prastow cek pajak budiman ini siapa tahu dia lah orang gak taat pajak ngomong seenak ee dewek .. malak warga indonesia 12 persen itu. berat itu..lu gak kena jadi seenaknya ngomong ..buset dah.,pak cek pajak budiman ini siapa tahu dia lah orang tidak taat pajak ngomong seenak ee dewek malak warga indonesia persen itu berat itulu tidak kena jadi seenaknya ngomong buset dah,pak cek pajak budiman ini siapa tahu dia lah orang tidak taat pajak ngomong seenak ee dewek malak warga indonesia persen itu berat itulu tidak kena jadi seenaknya ngomong buset dah
JHPrabowo,,1,Mari Kita Joget dan ngecap ------------------------------------------ PPN 12 Persen hingga Opsen Pajak Gaikindo: Industri Otomotif Makin Sulit - https://t.co/N6oGjRrSZB https://t.co/LCu0CNex4x,Mari Kita Joget dan ngecap PPN Persen hingga Opsen Pajak Gaikindo Industri Otomotif Makin Sulit,mari kita joget dan ngecap ppn persen hingga opsen pajak gaikindo industri otomotif makin sulit
Kopipait__78,,1,Sri Mulyani Umumkan Barang Kena PPN 12 Persen Pekan Depan.Menkeu Terbaik Dunia Keahlianya GaJauh Dari Menaikan Pajak Doank. Gaskeun lah Bu. https://t.co/OZk1iywEcN Kami siap dengan penjajahan ini,Sri Mulyani Umumkan Barang Kena PPN Persen Pekan DepanMenkeu Terbaik Dunia Keahlianya GaJauh Dari Menaikan Pajak Doank Gaskeun lah Bu Kami siap dengan penjajahan ini,sri mulyani umumkan barang kena ppn persen pekan depanmenkeu terbaik dunia keahlianya gajauh dari menaikan pajak doank gaskeun lah bu kami siap dengan penjajahan ini
niwseir,,1,In case masih ada yang tanya tiap bulan gajian dipotong pajak penghasilan dan PPN naik dari 10 persen jadi 11 persen dan akan naik jadi 12 persen itu untuk apa:,In case masih ada yang tanya tiap bulan gajian dipotong pajak penghasilan dan PPN naik dari persen jadi persen dan akan naik jadi persen itu untuk apa,in case masih ada yang tanya tiap bulan gajian dipotong pajak penghasilan dan ppn naik dari persen jadi persen dan akan naik jadi persen itu untuk apa
jifajah,jokowidodole,2,@jokowidodole @DavaDesma77195 @idextratime Lah elu yang mikir dapet apa tolol wkwkwkwk udahlah junjungannya kalah dapet pajak 12 persen terus makan siang gratis adek lu disunat lagi terus koalisinya pada gabung ke lawan wkwkwkwk tinggal apa dia tinggal ca,Lah elu yang mikir dapet apa tolol wkwkwkwk udahlah junjungannya kalah dapet pajak persen terus makan siang gratis adek lu disunat lagi terus koalisinya pada gabung ke lawan wkwkwkwk tinggal apa dia tinggal cari muka Nangis dulu sana anak haram,lah elu yang mikir dapet apa tolol wkwkwkwk udahlah junjungannya kalah dapet pajak persen terus makan siang gratis adek lu disunat lagi terus koalisinya pada gabung ke lawan wkwkwkwk tinggal apa dia tinggal cari muka nangis dulu sana anak haram
jolayaw,prastow,1,@prastow belum ada definisi pajak barang mewah yang kena PPN 12 persen ( yang barang mewah di definisi PPnBM diatur di PP 61/2020 pasti beda Universe ),belum ada definisi pajak barang mewah yang kena PPN persen yang barang mewah di definisi PPnBM diatur di PP pasti beda Universe,belum ada definisi pajak barang mewah yang kena ppn persen yang barang mewah di definisi ppnbm diatur di pp pasti beda universe
Putraserawai1,wonglicik062,1,@wonglicik062 sbr bu duit pajak yg 12 persen blom kumpul cari utangan sj dulu,sbr bu duit pajak yang persen blom kumpul cari utangan sj dulu,sbr bu duit pajak yang persen blom kumpul cari utangan sj dulu
perupadata,,2,Indonesia di tahun 2025 akan mengejar pendapatan negara senilai... 3 ribu triliun. 82 persen di antaranya akan dipenuhi dari pajak. Paling banyak dari Pajak Penghasilan (PPh) disusul oleh Pajak Pertambahan Nilai (PPN) yang memang sedang direncanakan naik jadi 12 persen. https://t.co/7lO2gdvSsi,Indonesia di tahun akan mengejar pendapatan negara senilai ribu triliun persen di antaranya akan dipenuhi dari pajak Paling banyak dari Pajak Penghasilan PPh disusul oleh Pajak Pertambahan Nilai PPN yang memang sedang direncanakan naik jadi persen,indonesia di tahun akan mengejar pendapatan negara senilai ribu triliun persen di antaranya akan dipenuhi dari pajak paling banyak dari pajak penghasilan pph disusul oleh pajak pertambahan nilai ppn yang memang sedang direncanakan naik jadi persen
beritaKBR,,0,Pemerintahan Presiden @Prabowo memutuskan kenaikan pajak menjadi 12 persen hanya diterapkan untuk barang mewah. Soal ketentuan rinci dan klasifikasi barang mewahnya bakal diatur di Kementerian Keuangan. Meski pemerintah berencana menaikkan PPN 12 persen untuk barang mewah https://t.co/oDOtO50M5g,Pemerintahan Presiden memutuskan kenaikan pajak menjadi persen hanya diterapkan untuk barang mewah Soal ketentuan rinci dan klasifikasi barang mewahnya bakal diatur di Kementerian Keuangan Meski pemerintah berencana menaikkan PPN persen untuk barang mewah,pemerintahan presiden memutuskan kenaikan pajak menjadi persen hanya diterapkan untuk barang mewah soal ketentuan rinci dan klasifikasi barang mewahnya bakal diatur di kementerian keuangan meski pemerintah berencana menaikkan ppn persen untuk barang mewah
nabila20386990,,2,Ketua MPR RI Ahmad Muzani menyatakan kebijakan pemberlakuan pajak pertambahan nilai (PPN) 12 persen untuk komoditas barang mewah tidak akan membebani rakyat. Kenaikan PPN itu bahkan dipastikan tak berdampak pada hajat hidup orang banyak. https://t.co/DvHGgwWX47,Ketua MPR RI Ahmad Muzani menyatakan kebijakan pemberlakuan pajak pertambahan nilai PPN persen untuk komoditas barang mewah tidak akan membebani rakyat Kenaikan PPN itu bahkan dipastikan tak berdampak pada hajat hidup orang banyak,ketua mpr ri ahmad muzani menyatakan kebijakan pemberlakuan pajak pertambahan nilai ppn persen untuk komoditas barang mewah tidak akan membebani rakyat kenaikan ppn itu bahkan dipastikan tak berdampak pada hajat hidup orang banyak
jawapos,,2,Sejumlah barang dipastikan tidak akan terkena dampak kenaikan pajak pertambahan nilai (PPN) 12 persen pada tahun depan. Menteri Keuangan Sri Mulyani Indrawati memastikan penerapan tarif baru PPN akan mengedepankan azas keadilan. Kebijakan sesuai dengan Undang-Undang https://t.co/jQDAvgcij3,Sejumlah barang dipastikan tidak akan terkena dampak kenaikan pajak pertambahan nilai PPN persen pada tahun depan Menteri Keuangan Sri Mulyani Indrawati memastikan penerapan tarif baru PPN akan mengedepankan azas keadilan Kebijakan sesuai dengan UndangUndang,sejumlah barang dipastikan tidak akan terkena dampak kenaikan pajak pertambahan nilai ppn persen pada tahun depan menteri keuangan sri mulyani indrawati memastikan penerapan tarif baru ppn akan mengedepankan azas keadilan kebijakan sesuai dengan undangundang
voaindonesia,,0,Menteri Keuangan Sri Mulyani Indrawati menyatakan tengah memfinalisasi daftar barang mewah yg akan dikenakan kenaikan pajak pertambahan nilai (PPN) 12 persen per 1 Januari 2025 dan hasilnya akan disampaikan bersama Menko Perekonomian dalam waktu dekat. https://t.co/PeIDwkNU1l,Menteri Keuangan Sri Mulyani Indrawati menyatakan tengah memfinalisasi daftar barang mewah yang akan dikenakan kenaikan pajak pertambahan nilai PPN persen per Januari dan hasilnya akan disampaikan bersama Menko Perekonomian dalam waktu dekat,menteri keuangan sri mulyani indrawati menyatakan tengah memfinalisasi daftar barang mewah yang akan dikenakan kenaikan pajak pertambahan nilai ppn persen per januari dan hasilnya akan disampaikan bersama menko perekonomian dalam waktu dekat
BenksWinarso,,1,PERLU DIJEDOTIN NIH? Kepala Badan Percepatan Pengentasan Kemiskinan (BP Taskin) Budiman Sudjatmiko mengatakan kenaikan pajak pertambahan nilai (PPN) menjadi 12 persen yang akan dikenakan terhadap barang mewah sudah tepat. Menurut Budiman orang tidak akan menjadi miskin hanya https://t.co/uDp3TKWdOK,PERLU DIJEDOTIN NIH Kepala Badan Percepatan Pengentasan Kemiskinan BP Taskin Budiman Sudjatmiko mengatakan kenaikan pajak pertambahan nilai PPN menjadi persen yang akan dikenakan terhadap barang mewah sudah tepat Menurut Budiman orang tidak akan menjadi miskin hanya,perlu dijedotin nih kepala badan percepatan pengentasan kemiskinan bp taskin budiman sudjatmiko mengatakan kenaikan pajak pertambahan nilai ppn menjadi persen yang akan dikenakan terhadap barang mewah sudah tepat menurut budiman orang tidak akan menjadi miskin hanya
endo_R7,detoge,0,@detoge @kumparan @kring_pajak @DitjenPajakRI PPN 12 persen khusus barang mevvah,PPN persen khusus barang mevvah,ppn persen khusus barang mevvah
Homo_sapiens21,,1,Pajak naik 12% persen? Coba diimbangi dengan hukuman mati 12 napi paling korup.,Pajak naik persen Coba diimbangi dengan hukuman mati napi paling korup,pajak naik persen coba diimbangi dengan hukuman mati napi paling korup
januarago,Puthutea,1,@Puthutea Pak Hadi Poernomo mantan dirjen pajak juga menolak kenaikan pajak 12%. Menurut perhitungan nya kenaikan pajak 1 persen menambah APBN 150T tidak menaikan pajak bisa menambah 250T asal pelaksanaan nya benar.,Pak Hadi Poernomo mantan dirjen pajak juga menolak kenaikan pajak Menurut perhitungan nya kenaikan pajak persen menambah APBN T tidak menaikan pajak bisa menambah T asal pelaksanaan nya benar,pak hadi poernomo mantan dirjen pajak juga menolak kenaikan pajak menurut perhitungan nya kenaikan pajak persen menambah apbn t tidak menaikan pajak bisa menambah t asal pelaksanaan nya benar
magdaleneid,,0,Pajak naik 12 persen?! Tax Morale solusinya! Tax Morale merupakan konsep di mana wajib pajak secara intrinsik termotivasi untuk membayar kewajiban pajaknya. Baca artikel selengkapnya di sini ya! https://t.co/7ScdHdPqz7,Pajak naik persen Tax Morale solusinya Tax Morale merupakan konsep di mana wajib pajak secara intrinsik termotivasi untuk membayar kewajiban pajaknya Baca artikel selengkapnya di sini ya,pajak naik persen tax morale solusinya tax morale merupakan konsep di mana wajib pajak secara intrinsik termotivasi untuk membayar kewajiban pajaknya baca artikel selengkapnya di sini ya
moch_suchron,rigeldzikrullah,0,@rigeldzikrullah @e100ss pajak 12 persen untuk barang mewah,pajak persen untuk barang mewah,pajak persen untuk barang mewah
ptrivinza,PrawakaZ,2,@PrawakaZ Dengan adanya pengaturan PPN 12 persen pemerintah bisa mengalokasikan dana pajak secara lebih tepat sasaran untuk program-program yang mendukung kesejahteraan masyarakat kecil,Dengan adanya pengaturan PPN persen pemerintah bisa mengalokasikan dana pajak secara lebih tepat sasaran untuk programprogram yang mendukung kesejahteraan masyarakat kecil,dengan adanya pengaturan ppn persen pemerintah bisa mengalokasikan dana pajak secara lebih tepat sasaran untuk programprogram yang mendukung kesejahteraan masyarakat kecil
